simulation_id,turn_number,speaker,message,word_count,char_count,timestamp
6683d487-39df-46d4-83d5-41b1732bedc2,4,Buyer,"I'm still not convinced that the potential benefits of DeepData AI outweigh the costs, and I'm concerned that the implementation timeline will be longer than you're suggesting, especially considering the complexity of integrating with our existing Alteryx infrastructure. Before agreeing to a meeting, I'd like to see a detailed breakdown of the costs, including any potential customization or support fees, to determine whether DeepData AI is truly a more cost-effective solution than our current setup or competing options like Alteryx's own AI-powered analytics tools.",84,571,2026-02-11T14:21:47.051264
e08a64bc-ac5c-4989-ba3b-e678bf5fac08,1,Seller,"Hi, this is Alex from DeepData AI. I noticed your company is scaling fast—are you currently struggling with data processing costs?",21,130,2026-02-11T15:22:28.301255
e08a64bc-ac5c-4989-ba3b-e678bf5fac08,1,Buyer,"I'm not convinced that we need another vendor trying to sell us a solution to a problem we may not even have, and with our current budget cycle just ending, I'm not sure we have the appetite for a new expense, especially with competitors like Google and Amazon already offering similar data processing services. Can you tell me what sets DeepData AI apart from the established players in the market?",70,399,2026-02-11T15:22:28.301255
e08a64bc-ac5c-4989-ba3b-e678bf5fac08,2,Seller,"I completely understand your concerns, but what sets DeepData AI apart is our proprietary AI-powered data processing technology that can reduce costs by up to 30% compared to traditional cloud providers like Google and Amazon, while also providing more accurate and actionable insights. I'd love to schedule a brief meeting to explore how our solution can specifically address your company's unique data processing challenges and provide a customized ROI analysis to ensure alignment with your budget priorities.",77,512,2026-02-11T15:22:28.301255
e08a64bc-ac5c-4989-ba3b-e678bf5fac08,2,Buyer,"I'm still not convinced that your proprietary technology can deliver the promised 30% cost reduction, especially when considering the potential integration costs and vendor lock-in risks associated with adopting a new, unproven solution. Can you provide concrete case studies or benchmarks that demonstrate the efficacy of your technology in reducing costs for similar companies, and how you plan to mitigate the risks of integration with our existing infrastructure?",68,467,2026-02-11T15:22:28.301255
e08a64bc-ac5c-4989-ba3b-e678bf5fac08,3,Seller,"I'd be happy to share case studies from similar companies in your industry, such as XYZ Corporation, which achieved a 32% reduction in data processing costs with DeepData AI, and I can also offer a complimentary integration assessment to identify potential risks and develop a tailored plan to ensure seamless integration with your existing infrastructure. Would you be open to a 15-minute meeting to discuss these case studies and assessment details, and explore how DeepData AI can drive tangible cost savings and insights for your business?",86,543,2026-02-11T15:22:28.301255
e08a64bc-ac5c-4989-ba3b-e678bf5fac08,3,Buyer,"I'm still not convinced that the potential cost savings outweigh the risks and costs of integrating a new, unproven solution, especially when considering the significant investments we've already made in our existing infrastructure with established players like Google and Amazon. Can you provide a more detailed breakdown of the total cost of ownership for your solution, including any upfront fees, subscription costs, and support expenses, to help me better understand the true ROI and how it compares to our current arrangements?",81,533,2026-02-11T15:22:28.301255
e08a64bc-ac5c-4989-ba3b-e678bf5fac08,4,Seller,"I'd be happy to provide a customized Total Cost of Ownership analysis, which typically shows that our customers achieve a significant ROI within the first 6-12 months of implementation, and I'd love to walk you through a detailed breakdown of the costs and benefits in a brief meeting. By doing so, we can also discuss how our flexible deployment options and interoperability features can minimize disruption to your existing infrastructure and maximize the value of your current investments with Google and Amazon.",82,515,2026-02-11T15:22:28.301255
e08a64bc-ac5c-4989-ba3b-e678bf5fac08,4,Buyer,"I'm still not convinced that the potential cost savings outweigh the risks, and I'm concerned that the upfront fees and subscription costs for DeepData AI's solution may be higher than what we're currently paying to Google and Amazon, which could negate any potential ROI within the first 6-12 months. Can you provide a detailed, apples-to-apples comparison of the costs and benefits of your solution versus our current arrangements with the established players, including any potential switching costs or penalties?",79,516,2026-02-11T15:22:28.301255
be9b60d5-a54e-456f-a413-54b55dc1eec5,1,Seller,"Hi, my name is Alex and I'm reaching out from DeepData AI. We're a data processing solution that helps companies like yours unlock insights from their data. I came across your company and noticed you're using SAP, but I saw that you're experiencing some access issues. Can you tell me a bit more about what's going on with that?",59,328,2026-02-11T15:29:56.395644
be9b60d5-a54e-456f-a413-54b55dc1eec5,1,Buyer,"(sighs) Yeah, we're having some problems with access permissions on our SAP server. But to be honest, I'm not sure how that's relevant to your product. We've got a lot on our plate right now, and I'm not looking to add any new vendors to the mix.",47,246,2026-02-11T15:29:56.395644
be9b60d5-a54e-456f-a413-54b55dc1eec5,2,Seller,"I completely understand your skepticism, but bear with me for a minute. Our solution can actually help alleviate some of the pain points you're experiencing with SAP. By integrating with your existing SAP system, DeepData AI can help you process and analyze large datasets more efficiently, which could potentially reduce the load on your server and mitigate some of those access issues. Have you considered how much time and resources your team is spending on data processing and analysis currently?",80,500,2026-02-11T15:29:56.395644
be9b60d5-a54e-456f-a413-54b55dc1eec5,2,Buyer,"(pauses) Okay, I'll give you that. We do spend a lot of time on data processing. But we've already invested heavily in our SAP system, and I'm not convinced that adding another solution on top of it is the best use of our resources. What makes DeepData AI so special that it's worth the additional cost and complexity?",58,318,2026-02-11T15:29:56.395644
be9b60d5-a54e-456f-a413-54b55dc1eec5,3,Seller,"That's a fair question. What sets us apart is our AI-powered engine that can handle complex data processing tasks at scale, without requiring significant infrastructure upgrades or additional headcount. We've seen companies like yours achieve significant ROI by reducing manual data processing time by up to 70% and improving data accuracy by up to 90%. I'd love to schedule a follow-up conversation to dive deeper into how DeepData AI can address your specific pain points and provide a customized demo. Would you be open to that?",86,531,2026-02-11T15:29:56.395644
be9b60d5-a54e-456f-a413-54b55dc1eec5,3,Buyer,"(hesitates) Okay, fine. I'll give you 30 minutes next week. But I'm warning you, I'm going to be tough to convince. And if this is just a sales pitch, you're wasting your time. I need to see real value and a clear understanding of how this integrates with our existing SAP system.",52,280,2026-02-11T15:29:56.395644
be9b60d5-a54e-456f-a413-54b55dc1eec5,4,Seller,"Absolutely, I understand. I'll make sure to come prepared with specific examples and a tailored demo that speaks to your needs. I'm looking forward to our conversation next week and exploring how DeepData AI can help your team achieve their goals. Thank you for considering our solution, and I'll talk to you soon.",53,314,2026-02-11T15:29:56.395644
cd370073-2cee-4092-ad55-fa8445a1986a,1,Seller,"Hi, this is Alex from DeepData AI. I noticed your company is scaling fast—are you currently struggling with data processing costs?",21,130,2026-02-16T12:45:52.762621
cd370073-2cee-4092-ad55-fa8445a1986a,1,Buyer,"""We've indeed been scaling rapidly, but I'm not convinced that your solution would be cost-effective for us, especially considering the hefty price tags I've seen from similar AI-powered data processing vendors. Can you tell me what sets DeepData AI apart from competitors like Google Cloud or AWS, and how you plan to justify the investment?""",55,343,2026-02-16T12:45:52.762621
cd370073-2cee-4092-ad55-fa8445a1986a,2,Seller,"I completely understand your concern about cost-effectiveness, but what sets DeepData AI apart is our proprietary AI engine that can reduce data processing costs by up to 30% while increasing processing speeds by 5x, allowing our customers to scale efficiently without breaking the bank. I'd love to schedule a meeting to walk you through a customized ROI analysis and demonstrate how DeepData AI can specifically address your company's unique data processing challenges.",72,471,2026-02-16T12:45:52.762621
cd370073-2cee-4092-ad55-fa8445a1986a,2,Buyer,"I'm still not convinced that your proprietary AI engine can deliver on its promises, especially when compared to the likes of Google Cloud or AWS, which have far more resources and expertise in data processing. Can you provide any concrete case studies or benchmarks that demonstrate the 30% cost reduction and 5x speed increase you're claiming, and how do you plan to ensure that your solution integrates seamlessly with our existing infrastructure?",72,450,2026-02-16T12:45:52.762621
cd370073-2cee-4092-ad55-fa8445a1986a,3,Seller,"I'd be happy to share a case study from a similar company in your industry, where we've achieved a 32% reduction in data processing costs and a 6x increase in processing speed, and I can also offer a complimentary integration assessment to ensure seamless integration with your existing infrastructure. Would you be open to a 15-minute meeting to review the case study and discuss how DeepData AI can address your specific data processing challenges?",74,450,2026-02-16T12:45:52.762621
cd370073-2cee-4092-ad55-fa8445a1986a,3,Buyer,"I'm not convinced that a single case study from a similar company is sufficient to demonstrate the effectiveness of your solution, especially when considering the significant investment required to implement DeepData AI. Furthermore, I'm concerned that your pricing model may not be competitive with the customized solutions offered by Google Cloud or AWS, which could offer more flexible and cost-effective options for our specific use case.",66,442,2026-02-16T12:45:52.762621
cd370073-2cee-4092-ad55-fa8445a1986a,4,Seller,"I understand your desire for more comprehensive validation, which is why I'd like to offer a pilot program that allows you to test DeepData AI's capabilities in your own environment, providing a firsthand look at the cost savings and efficiency gains we can deliver. This will also give us the opportunity to tailor a customized pricing model that meets your specific needs and use case, ensuring that our solution is not only effective but also competitive with other options on the market.",82,491,2026-02-16T12:45:52.762621
cd370073-2cee-4092-ad55-fa8445a1986a,4,Buyer,"I'm still hesitant to commit to a pilot program without a clearer understanding of the costs involved, as I'm concerned that the upfront investment required to test DeepData AI's capabilities could be prohibitively expensive, especially when compared to the customized solutions offered by our existing cloud providers, Google Cloud and AWS. Can you provide a detailed breakdown of the costs associated with the pilot program and how they will be structured, to help me better evaluate the potential return on investment?",81,521,2026-02-16T12:45:52.762621
24e246cc-7936-4082-8eb5-e59140329220,1,Seller,"Hi, this is Alex from DeepData AI. I noticed your company is scaling fast—are you currently struggling with data processing costs?",21,130,2026-02-16T12:50:19.531607
24e246cc-7936-4082-8eb5-e59140329220,1,Buyer,"""I'm not convinced that our data processing costs are a significant concern at this point, and even if they were, I'd expect a solution like yours to come with a hefty price tag - can you tell me how your pricing compares to what we're currently paying for our existing data infrastructure?""",52,291,2026-02-16T12:50:19.531607
24e246cc-7936-4082-8eb5-e59140329220,2,Seller,"I completely understand your skepticism, but our clients have seen an average reduction of 30-40% in their data processing costs after implementing DeepData AI, and I'd love to explore how our solution can provide similar value to your organization. Can I schedule a brief meeting to discuss your current data infrastructure and see if our solution can help optimize your costs and drive business growth?",65,404,2026-02-16T12:50:19.531607
24e246cc-7936-4082-8eb5-e59140329220,2,Buyer,"I'm still not convinced that the potential cost savings outweigh the likely hefty upfront investment required to implement DeepData AI, and I'd need to see a more detailed breakdown of your pricing model and ROI projections before considering a meeting. Additionally, I've heard similar claims from your competitors, such as DataSphere and IntelliAnalytics, so what sets DeepData AI apart from them?",61,399,2026-02-16T12:50:19.531607
24e246cc-7936-4082-8eb5-e59140329220,3,Seller,"I'd be happy to provide a customized pricing breakdown and ROI analysis tailored to your organization's specific needs, but I'd like to do so in the context of a brief meeting where we can discuss your current data infrastructure and identify areas where DeepData AI can drive the most value. Unlike DataSphere and IntelliAnalytics, our AI-powered solution provides real-time data processing and advanced analytics capabilities that have been proven to deliver 2-3 times faster time-to-insight and 25% higher data accuracy for our clients.",83,539,2026-02-16T12:50:19.531607
24e246cc-7936-4082-8eb5-e59140329220,3,Buyer,"I'm still not convinced that the benefits of DeepData AI's real-time data processing and advanced analytics capabilities outweigh the costs, and I'd like to see concrete case studies or benchmarks that demonstrate a significant advantage over DataSphere and IntelliAnalytics, rather than just relying on claims of faster time-to-insight and higher data accuracy. Additionally, I'm concerned that implementing a new AI-powered solution like DeepData AI will require significant upfront investment and disruption to our existing data infrastructure, which could take months to realize any potential ROI.",85,601,2026-02-16T12:50:19.531607
24e246cc-7936-4082-8eb5-e59140329220,4,Seller,"I understand your concerns, but I'd like to share a case study from a similar company in your industry that saw a 35% reduction in data processing costs and a 20% increase in revenue after implementing DeepData AI, which I can walk you through in a brief meeting. By discussing your specific challenges and goals, I can help you understand how our solution can drive tangible business value and provide a clear ROI, despite the initial investment, and address any potential disruption to your existing infrastructure.",86,517,2026-02-16T12:50:19.531607
24e246cc-7936-4082-8eb5-e59140329220,4,Buyer,"I'm still not convinced that the potential benefits of DeepData AI outweigh the costs, and I'd like to see a detailed analysis of the total cost of ownership, including any additional personnel or resources required to implement and maintain your solution, before considering a meeting. Additionally, I'd like to know how your pricing compares to DataSphere's recent promotion, which offers a similar AI-powered solution at a significantly discounted rate for the first year.",73,475,2026-02-16T12:50:19.531607
8459130f-233f-4a73-977b-8a960c762b28,1,Seller,"Hi, Dr. Lee. My name is Alex, and I'm a Sales Development Representative at DeepData AI. I came across your company, and I was impressed with the work you're doing in the cybersecurity space. I wanted to reach out and explore potential synergies between our companies. Can you tell me a bit about your current data processing challenges?",58,337,2026-02-16T17:14:47.415836
8459130f-233f-4a73-977b-8a960c762b28,1,Buyer,"(sighs) Look, Alex, we're busy with our own security solutions, and I'm not sure we need another data processing tool. What makes DeepData AI so special that it's worth my time?",31,177,2026-02-16T17:14:47.415836
8459130f-233f-4a73-977b-8a960c762b28,2,Seller,"I completely understand your skepticism, Dr. Lee. However, our AI-native data processing solution has been shown to increase data analysis speed by up to 500% while reducing costs by 30%. We've had success with similar companies in the cybersecurity industry, and I believe we could help you optimize your security operations. For example, our solution can help you analyze vast amounts of threat data in real-time, enabling your team to respond more quickly to potential breaches.",76,481,2026-02-16T17:14:47.415836
8459130f-233f-4a73-977b-8a960c762b28,2,Buyer,"(chuckles) Those sound like impressive numbers, but I've heard claims like that before. What makes you think your solution can actually deliver on those promises? We've invested heavily in our own data processing infrastructure, and I'm not sure I want to rip and replace it with something new.",48,294,2026-02-16T17:14:47.415836
8459130f-233f-4a73-977b-8a960c762b28,3,Seller,"I understand your concern, Dr. Lee. That's why I'd like to offer you a personalized demo of our solution, using your own data. This will give you a chance to see the value of DeepData AI firsthand, and we can discuss how our solution can integrate with your existing infrastructure. We've had success with integrating our solution with companies that have similar architectures to yours, and I believe we can do the same for you.",75,429,2026-02-16T17:14:47.415836
8459130f-233f-4a73-977b-8a960c762b28,3,Buyer,"(pauses) Okay, fine. I'll give you 30 minutes of my time for a demo. But if this is just a sales pitch, I'm walking out. I need to see real value, and I need to see it quickly. Can you guarantee that your solution can handle the scale and complexity of our data?",53,262,2026-02-16T17:14:47.415836
8459130f-233f-4a73-977b-8a960c762b28,4,Seller,"Absolutely, Dr. Lee. We've worked with companies that have similar data volumes and complexity, and our solution has been able to handle it with ease. In fact, one of our current customers is processing over 10 petabytes of data per day with our solution. I'm confident that we can do the same for you. I'll schedule the demo for next week, and I'll make sure that our team is prepared to address any questions or concerns you may have.",79,436,2026-02-16T17:14:47.415836
b7625829-fd1c-4be6-a2ea-a339d55d5843,1,Seller,"Hi, this is Alex from DeepData AI. I noticed your company is scaling fast—are you currently struggling with data processing costs?",21,130,2026-02-16T17:37:24.062875
b7625829-fd1c-4be6-a2ea-a339d55d5843,1,Buyer,"""We're indeed scaling quickly, but I'm not convinced that your solution is the most cost-effective option, especially considering the hefty price tags I've seen from similar AI startups like NVIDIA and IBM - how does your pricing model compare to theirs?""",41,255,2026-02-16T17:37:24.062875
b7625829-fd1c-4be6-a2ea-a339d55d5843,2,Seller,"""I completely understand your concern, but our pricing model is actually tailored to provide significant cost savings compared to traditional solutions from NVIDIA and IBM, with some of our customers seeing up to 30% reduction in data processing costs. I'd love to schedule a meeting to walk you through a customized analysis of how DeepData AI can specifically address your company's needs and provide a more detailed comparison of our pricing model.""",72,452,2026-02-16T17:37:24.062875
b7625829-fd1c-4be6-a2ea-a339d55d5843,2,Buyer,"I'm not convinced that a 30% reduction in data processing costs is sufficient to justify the investment in your solution, especially when considering the significant upfront costs and potential integration complexities. Can you provide concrete case studies or benchmarks that demonstrate the ROI of your solution in the autonomous driving simulation space, and how it compares to established players like NVIDIA and IBM?",63,421,2026-02-16T17:37:24.062875
b7625829-fd1c-4be6-a2ea-a339d55d5843,3,Seller,"I'd be happy to share a case study from one of our existing customers in the autonomous driving space, such as Aurora Innovation, who achieved a 42% reduction in data processing costs and a 25% decrease in simulation time with DeepData AI. Let's schedule a meeting to dive deeper into the specifics of their success and explore how our solution can deliver similar ROI for your organization, tailored to your unique needs and goals.",74,432,2026-02-16T17:37:24.062875
b7625829-fd1c-4be6-a2ea-a339d55d5843,3,Buyer,"I'm still not convinced that the potential cost savings outweigh the investment, especially when considering that NVIDIA and IBM have already established strong partnerships in the autonomous driving space, and I'd need to see more robust benchmarks and a detailed breakdown of the total cost of ownership before considering a meeting. Furthermore, a 42% reduction in data processing costs is impressive, but what are the actual dollar figures and how does that translate to our specific use case with CARLA Simulator, which has its own unique requirements and complexities?",89,574,2026-02-16T17:37:24.062875
b7625829-fd1c-4be6-a2ea-a339d55d5843,4,Seller,"I'd like to provide a customized analysis of how DeepData AI can integrate with CARLA Simulator and address your specific requirements, which would allow me to share more precise dollar figures and ROI projections tailored to your use case. Let's schedule a meeting to discuss this further and explore how our solution can help you achieve significant cost savings and improved simulation efficiency, despite the established partnerships of NVIDIA and IBM, by leveraging our proprietary AI technology and expertise in autonomous driving simulation.",83,548,2026-02-16T17:37:24.062875
b7625829-fd1c-4be6-a2ea-a339d55d5843,4,Buyer,"I'm still hesitant to commit to a meeting without seeing more concrete evidence of your solution's value proposition, particularly given the significant investment required and the existing relationships we have with industry leaders like NVIDIA and IBM. Can you provide a detailed, written proposal outlining the specific cost savings and efficiency gains you believe DeepData AI can bring to our CARLA Simulator implementation, rather than relying on generalized claims and case studies?",72,489,2026-02-16T17:37:24.062875
804b9ee8-0cb1-4a1c-8436-86c24ea9706c,1,Seller,"Hi, my name is Alex and I'm reaching out from DeepData AI. We're a data processing solutions company and I came across your company while researching potential partners. I noticed you're experiencing some issues with accessing certain websites, such as Intel's website, and I think our solution could help mitigate those problems by optimizing your data flow and reducing latency.",60,380,2026-02-17T17:36:04.294655
804b9ee8-0cb1-4a1c-8436-86c24ea9706c,1,Buyer,"(skeptical) Oh, you mean the ""Access Denied"" error we've been getting? That's just a minor issue with our proxy server. I'm not sure how your data processing solution would help with that. We've already got a team looking into it.",40,230,2026-02-17T17:36:04.294655
804b9ee8-0cb1-4a1c-8436-86c24ea9706c,2,Seller,"I understand your concern, but our solution has helped similar companies resolve issues like this by streamlining their data pipelines and improving network efficiency. For instance, one of our clients was experiencing similar access issues due to their outdated data infrastructure, and after implementing DeepData AI, they saw a significant reduction in errors and an increase in overall system performance. Would you be open to exploring how our solution could help your team resolve this issue more efficiently?",78,515,2026-02-17T17:36:04.294655
804b9ee8-0cb1-4a1c-8436-86c24ea9706c,2,Buyer,"(still skeptical) I'm not convinced. We've got a lot of custom-built solutions in place, and I'm not sure I want to introduce another vendor into the mix. What makes you think your solution is going to be any better than what we've already got? And how would you even integrate with our existing systems?",54,304,2026-02-17T17:36:04.294655
804b9ee8-0cb1-4a1c-8436-86c24ea9706c,3,Seller,"That's a fair question. Our solution is designed to be highly adaptable and can integrate with a wide range of existing systems. We've worked with companies that have complex, custom-built infrastructures, and we've been able to seamlessly integrate our solution to enhance their data processing capabilities. I'd be happy to set up a demo to show you exactly how DeepData AI can work with your systems and address your specific pain points. Would that be something you'd be interested in?",80,489,2026-02-17T17:36:04.294655
804b9ee8-0cb1-4a1c-8436-86c24ea9706c,3,Buyer,"(somewhat intrigued) Okay, fine. I'll take a look. But like I said, we're not looking to add any more complexity to our systems. If your solution can't demonstrate clear value and ease of integration, then I'm not interested. When were you thinking of scheduling this demo?",46,273,2026-02-17T17:36:04.294655
