simulation_id,turn_number,speaker,message,word_count,char_count,timestamp
f83119cb-7a09-4622-abbe-f58a6658ff99,3,Seller,"I completely understand your concern about adding another tool. But our solution is designed to be highly integrable and flexible. We have pre-built connectors for popular tools like Figma, Jira, and others, so you can easily integrate our solution with your existing workflow. We can also provide customized onboarding and support to ensure a seamless transition. In terms of ROI, our customers have seen an average reduction of 30% in data processing time and a 25% increase in design iteration speed. Would you be open to exploring a pilot project to see how our solution can specifically address your pain points?",101,617,2026-02-16T17:15:00.395007
f83119cb-7a09-4622-abbe-f58a6658ff99,3,Buyer,(still skeptical) I'm not convinced yet. Can you provide some case studies or references from similar companies that have seen success with your solution? And what kind of support and training do you offer to ensure our team can get up to speed quickly?,44,253,2026-02-16T17:15:00.395007
f83119cb-7a09-4622-abbe-f58a6658ff99,4,Seller,"Absolutely. I can share some case studies and references from companies like Airbnb, Uber, and others who have seen significant benefits from our solution. We also offer dedicated onboarding, training, and ongoing support to ensure your team can get the most out of our solution. In fact, we have a customer success program that assigns a dedicated success manager to each customer to ensure they achieve their goals. Would you like me to send over some case studies and schedule a follow-up call to discuss further?",86,516,2026-02-16T17:15:00.395007
e6899bce-f281-4408-bb25-1174670db687,1,Seller,"Hi, my name is Rachel and I'm a Sales Development Representative at DeepData AI. I came across your company and was impressed with the work you're doing in content management and collaboration. I'd love to introduce you to our solution that can help you unlock the full potential of your content with AI-powered data extraction.",55,328,2026-02-16T17:15:06.472427
e6899bce-f281-4408-bb25-1174670db687,1,Buyer,"(sighs) Another AI solution, huh? What makes yours so special? We already have a robust system in place with Box, and I'm not sure we're looking to add another tool to the mix.",33,176,2026-02-16T17:15:06.472427
e6899bce-f281-4408-bb25-1174670db687,2,Seller,"I completely understand your skepticism, and I appreciate your honesty. However, our DeepData AI solution is designed to complement existing content management systems like Box. We focus specifically on data extraction and processing, using machine learning algorithms to identify and retrieve critical information from unstructured data. This can help you automate workflows, reduce manual labor, and gain valuable insights from your content.",62,443,2026-02-16T17:15:06.472427
e6899bce-f281-4408-bb25-1174670db687,2,Buyer,"(interrupting) I see. So, you're saying this is just another automation tool? We've already implemented no-code automation with Box, and it's been working well for us. What's the value proposition here?",31,202,2026-02-16T17:15:06.472427
e6899bce-f281-4408-bb25-1174670db687,3,Seller,"While Box's automation capabilities are impressive, our solution is designed to handle complex, high-volume data extraction tasks that may be beyond the scope of their automation tools. For example, if you have a large repository of contracts or financial documents, our AI-powered extraction agents can quickly and accurately identify and retrieve specific data points, such as contract expiration dates or payment terms. This can help you make more informed decisions, reduce risk, and improve compliance.",75,507,2026-02-16T17:15:06.472427
e6899bce-f281-4408-bb25-1174670db687,3,Buyer,"(somewhat intrigued) I'll give you that – data extraction can be a pain point for us. But how do I know this won't just add more complexity to our existing infrastructure? We've had issues with integration in the past, and I don't want to disrupt our current workflows.",48,269,2026-02-16T17:15:06.472427
e6899bce-f281-4408-bb25-1174670db687,4,Seller,"That's a valid concern. Our solution is designed to be highly adaptable and integrates seamlessly with existing systems, including Box. We've worked with numerous customers who have similar infrastructure, and our implementation team will work closely with you to ensure a smooth onboarding process. We also offer a pilot program to test our solution with a small subset of your data, so you can see the value proposition firsthand before making a larger commitment.",74,466,2026-02-16T17:15:06.472427
e6899bce-f281-4408-bb25-1174670db687,4,Buyer,"(thoughtfully) Okay, I'll consider it. But I need to see some concrete examples of how this can benefit our organization. Can you send me some case studies or arrange a follow-up call to discuss further?",35,203,2026-02-16T17:15:06.472427
e6899bce-f281-4408-bb25-1174670db687,5,Seller,"Absolutely. I'll send over some relevant case studies and arrange a follow-up call at your convenience. Thank you for your time today, and I look forward to exploring how DeepData AI can help your organization thrive in the AI-first era of business.",42,249,2026-02-16T17:15:06.472427
1a6b1198-47c5-4aa4-84ed-709805dcb084,1,Seller,"Hi, my name is Alex and I'm reaching out from DeepData AI. I came across your company, and I was impressed by the work you're doing with UiPath automation platform. I'd love to explore how our data processing solution can complement your existing automation efforts and drive even more value for your organization.",53,314,2026-02-16T17:15:12.690780
1a6b1198-47c5-4aa4-84ed-709805dcb084,1,Buyer,"(skeptical) Ah, another sales call. What makes you think we need another solution when we're already investing in UiPath? We've got our automation platform in place, and I'm not sure what gap your product is supposed to fill.",38,225,2026-02-16T17:15:12.690780
1a6b1198-47c5-4aa4-84ed-709805dcb084,2,Seller,"I completely understand your skepticism, and I appreciate the investment you've made in UiPath. However, our solution is designed to work in tandem with automation platforms like UiPath, enhancing their capabilities by providing more accurate and efficient data processing. This can help you unlock even more value from your automation efforts. For example, we've seen companies like WEX and AGS Health achieve significant cost savings and operational efficiencies by streamlining their data processing with our solution.",76,521,2026-02-16T17:15:12.690780
1a6b1198-47c5-4aa4-84ed-709805dcb084,2,Buyer,"(still skeptical) I'm not convinced. We've already got a robust automation platform in place, and I'm not sure I want to add another vendor to the mix. What makes your solution so unique that it's worth considering?",37,215,2026-02-16T17:15:12.690780
1a6b1198-47c5-4aa4-84ed-709805dcb084,3,Seller,"I understand your concerns about adding another vendor, but I'd like to highlight that our solution is designed to be vendor-agnostic and can integrate seamlessly with UiPath. Our unique value proposition lies in our ability to process complex data sets with high accuracy and speed, which can help you make more informed decisions and drive business outcomes. For instance, our solution can help you process large volumes of claims data in healthcare or trade exception data in finance, allowing your teams to focus on higher-value tasks.",86,539,2026-02-16T17:15:12.690780
1a6b1198-47c5-4aa4-84ed-709805dcb084,3,Buyer,"(somewhat interested) Okay, I'll bite. What kind of ROI can we expect from implementing your solution? And how does it handle data security and compliance, especially in regulated industries like finance and healthcare?",33,219,2026-02-16T17:15:12.690780
1a6b1198-47c5-4aa4-84ed-709805dcb084,4,Seller,"We've seen our customers achieve significant ROI, often in the range of 3-5 times their initial investment, by reducing manual data processing errors, increasing operational efficiencies, and improving decision-making. Regarding data security and compliance, our solution is designed with enterprise-grade security and compliance in mind, meeting all major regulatory requirements, including GDPR, HIPAA, and SOC 2. We've worked with numerous customers in regulated industries, and I'd be happy to provide case studies and references to demonstrate our capabilities. Would you like to schedule a follow-up conversation to explore this further?",90,643,2026-02-16T17:15:12.690780
b7625829-fd1c-4be6-a2ea-a339d55d5843,1,Seller,"Hi, this is Alex from DeepData AI. I noticed your company is scaling fast—are you currently struggling with data processing costs?",21,130,2026-02-16T17:37:24.062875
b7625829-fd1c-4be6-a2ea-a339d55d5843,1,Buyer,"""We're indeed scaling quickly, but I'm not convinced that your solution is the most cost-effective option, especially considering the hefty price tags I've seen from similar AI startups like NVIDIA and IBM - how does your pricing model compare to theirs?""",41,255,2026-02-16T17:37:24.062875
b7625829-fd1c-4be6-a2ea-a339d55d5843,2,Seller,"""I completely understand your concern, but our pricing model is actually tailored to provide significant cost savings compared to traditional solutions from NVIDIA and IBM, with some of our customers seeing up to 30% reduction in data processing costs. I'd love to schedule a meeting to walk you through a customized analysis of how DeepData AI can specifically address your company's needs and provide a more detailed comparison of our pricing model.""",72,452,2026-02-16T17:37:24.062875
b7625829-fd1c-4be6-a2ea-a339d55d5843,2,Buyer,"I'm not convinced that a 30% reduction in data processing costs is sufficient to justify the investment in your solution, especially when considering the significant upfront costs and potential integration complexities. Can you provide concrete case studies or benchmarks that demonstrate the ROI of your solution in the autonomous driving simulation space, and how it compares to established players like NVIDIA and IBM?",63,421,2026-02-16T17:37:24.062875
b7625829-fd1c-4be6-a2ea-a339d55d5843,3,Seller,"I'd be happy to share a case study from one of our existing customers in the autonomous driving space, such as Aurora Innovation, who achieved a 42% reduction in data processing costs and a 25% decrease in simulation time with DeepData AI. Let's schedule a meeting to dive deeper into the specifics of their success and explore how our solution can deliver similar ROI for your organization, tailored to your unique needs and goals.",74,432,2026-02-16T17:37:24.062875
b7625829-fd1c-4be6-a2ea-a339d55d5843,3,Buyer,"I'm still not convinced that the potential cost savings outweigh the investment, especially when considering that NVIDIA and IBM have already established strong partnerships in the autonomous driving space, and I'd need to see more robust benchmarks and a detailed breakdown of the total cost of ownership before considering a meeting. Furthermore, a 42% reduction in data processing costs is impressive, but what are the actual dollar figures and how does that translate to our specific use case with CARLA Simulator, which has its own unique requirements and complexities?",89,574,2026-02-16T17:37:24.062875
b7625829-fd1c-4be6-a2ea-a339d55d5843,4,Seller,"I'd like to provide a customized analysis of how DeepData AI can integrate with CARLA Simulator and address your specific requirements, which would allow me to share more precise dollar figures and ROI projections tailored to your use case. Let's schedule a meeting to discuss this further and explore how our solution can help you achieve significant cost savings and improved simulation efficiency, despite the established partnerships of NVIDIA and IBM, by leveraging our proprietary AI technology and expertise in autonomous driving simulation.",83,548,2026-02-16T17:37:24.062875
b7625829-fd1c-4be6-a2ea-a339d55d5843,4,Buyer,"I'm still hesitant to commit to a meeting without seeing more concrete evidence of your solution's value proposition, particularly given the significant investment required and the existing relationships we have with industry leaders like NVIDIA and IBM. Can you provide a detailed, written proposal outlining the specific cost savings and efficiency gains you believe DeepData AI can bring to our CARLA Simulator implementation, rather than relying on generalized claims and case studies?",72,489,2026-02-16T17:37:24.062875
898a38e7-405c-4fd1-b9f5-412f764bb0b4,1,Seller,"Hi, my name is Emily and I'm a Sales Development Representative at DeepData AI. I came across your company while researching innovative tech firms, and I noticed you're using GitHub for your development needs. I'd love to explore how our data processing solution can help you streamline your workflow and improve collaboration among your teams.",55,344,2026-02-17T17:35:19.581535
898a38e7-405c-4fd1-b9f5-412f764bb0b4,1,Buyer,"(skeptical) Ah, another sales call. What makes you think we need another tool to add to our stack? We're already using GitHub, and it's working fine for us. What's DeepData AI going to do for us that GitHub can't?",39,213,2026-02-17T17:35:19.581535
898a38e7-405c-4fd1-b9f5-412f764bb0b4,2,Seller,"That's a fair question. While GitHub is an excellent platform for version control and collaboration, DeepData AI is specifically designed to help you extract insights from your data. Our solution uses machine learning algorithms to process large datasets, identify patterns, and provide actionable recommendations. This can help your teams make data-driven decisions, reduce errors, and increase efficiency. For example, we've worked with similar companies to help them optimize their code review process and reduce merge conflicts by up to 30%.",80,545,2026-02-17T17:35:19.581535
898a38e7-405c-4fd1-b9f5-412f764bb0b4,2,Buyer,"(still skeptical) I'm not sure I buy into the whole ""AI-powered"" sales pitch. We've tried other data analytics tools before, and they've been a disappointment. What makes DeepData AI different? And how do you plan to integrate with our existing GitHub workflow?",42,261,2026-02-17T17:35:19.581535
898a38e7-405c-4fd1-b9f5-412f764bb0b4,3,Seller,"I completely understand your concerns. DeepData AI is different because it's specifically designed for developers and engineering teams. Our solution integrates seamlessly with GitHub, allowing you to import your code repositories, track data changes, and visualize insights directly within your existing workflow. We've also developed a unique algorithm that can handle complex data structures and provide accurate predictions. I'd be happy to set up a demo to show you how it works and address any technical questions you may have.",80,533,2026-02-17T17:35:19.581535
898a38e7-405c-4fd1-b9f5-412f764bb0b4,3,Buyer,"(somewhat interested) Okay, I'll give you 10 minutes to show me what you've got. But if this is just a fancy sales demo, I'm hanging up. Can you also explain how you plan to handle our sensitive data and ensure compliance with our security protocols?",45,250,2026-02-17T17:35:19.581535
898a38e7-405c-4fd1-b9f5-412f764bb0b4,4,Seller,"Absolutely. Data security is our top priority. We've implemented robust encryption, access controls, and auditing mechanisms to ensure that your data is protected. We're also compliant with major industry standards, including GDPR and SOC 2. During the demo, I can walk you through our security features and provide any additional information you need to feel confident about our solution. Would you like to schedule a demo for this week or next?",71,446,2026-02-17T17:35:19.581535
7a41cacf-1bc3-4002-9add-256300058999,1,Seller,"Hi, my name is Alex and I'm a Sales Development Representative from DeepData AI. I came across your company, monday.com, and was impressed by the work you're doing in the AI work platform space. I'd love to explore how our data processing solution can help you streamline your operations and improve your bottom line.",54,317,2026-02-17T17:35:29.245211
7a41cacf-1bc3-4002-9add-256300058999,1,Buyer,"(skeptical) Ah, another AI solution, huh? What makes DeepData AI so special? We already have a robust platform with various features, including AI-powered tools. I'm not sure we need another solution.",31,200,2026-02-17T17:35:29.245211
7a41cacf-1bc3-4002-9add-256300058999,2,Seller,"I completely understand your skepticism, but our solution is designed to complement existing platforms like yours. DeepData AI focuses on advanced data processing, which can help you uncover hidden insights and make more informed decisions. Our solution can integrate seamlessly with your current infrastructure, enhancing your AI capabilities without disrupting your workflow.",52,377,2026-02-17T17:35:29.245211
7a41cacf-1bc3-4002-9add-256300058999,2,Buyer,"(still skeptical) That sounds interesting, but we've invested heavily in our own AI development. I'm not convinced that we need an external solution. Plus, how do I know your solution will work with our existing systems? We have a complex tech stack, and integration can be a nightmare.",48,286,2026-02-17T17:35:29.245211
7a41cacf-1bc3-4002-9add-256300058999,3,Seller,"I understand your concerns about integration, and I'd like to address them directly. We've worked with several companies with similar tech stacks, and our solution has proven to be highly adaptable. We also offer a free trial and a dedicated onboarding process to ensure a smooth integration. As for the value proposition, our solution can help you process large datasets more efficiently, reducing the load on your internal systems and freeing up resources for more strategic initiatives. Would you be open to a demo to see how our solution can specifically address your company's needs?",95,588,2026-02-17T17:35:29.245211
7a41cacf-1bc3-4002-9add-256300058999,3,Buyer,"(somewhat intrigued) Okay, I'm willing to listen. But I need to see concrete examples of how your solution can help us. Can you provide case studies or references from similar companies in our industry? And what kind of support do you offer to ensure a successful implementation?",47,279,2026-02-17T17:35:29.245211
7a41cacf-1bc3-4002-9add-256300058999,4,Seller,"Absolutely, we have several case studies from companies in the AI work platform space, and I'd be happy to share them with you. We also offer 24/7 support, regular software updates, and a dedicated customer success team to ensure our solution meets your evolving needs. I can schedule a follow-up call to discuss the case studies and answer any further questions you may have. Would that work for you?",69,401,2026-02-17T17:35:29.245211
6bcb065d-53dc-4918-87d2-6dababea6a0f,1,Seller,"Hi, my name is Alex and I'm a Sales Development Representative at DeepData AI. I came across your company, Miro, and was impressed by the collaborative AI workflows you're offering to your customers. I'd love to explore how our data processing solution can help you enhance your services.",48,288,2026-02-17T17:35:38.181213
6bcb065d-53dc-4918-87d2-6dababea6a0f,1,Buyer,"(skeptical) Ah, another sales call. What makes you think we need your data processing solution, Alex? We're already handling our data processing in-house.",23,154,2026-02-17T17:35:38.181213
6bcb065d-53dc-4918-87d2-6dababea6a0f,2,Seller,"That's completely understandable. Many companies start out handling data processing internally, but as they scale, it can become a bottleneck. Our solution, DeepData AI, is designed to help companies like yours process large amounts of data quickly and efficiently, freeing up resources for more strategic initiatives. We've seen significant ROI for our customers in similar industries. Can I ask, what are some of the biggest data-related challenges you're facing at Miro right now?",73,483,2026-02-17T17:35:38.181213
6bcb065d-53dc-4918-87d2-6dababea6a0f,2,Buyer,"(still skeptical) Honestly, our biggest challenge is ensuring the quality and security of our users' data. We can't afford to have any breaches or downtime. How can I be sure your solution won't introduce new risks?",36,215,2026-02-17T17:35:38.181213
6bcb065d-53dc-4918-87d2-6dababea6a0f,3,Seller,"Data security is our top priority at DeepData AI. Our solution is built with enterprise-grade security features, including encryption, access controls, and regular audits. We're also compliant with major regulatory standards, such as GDPR and HIPAA. I'd be happy to provide you with case studies from our existing customers in the tech industry, who have seen significant improvements in data quality and security with our solution.",66,432,2026-02-17T17:35:38.181213
6bcb065d-53dc-4918-87d2-6dababea6a0f,3,Buyer,"(somewhat interested) Okay, I'd like to see those case studies. But I have to say, we're not looking to add new vendors to our stack right now. We're trying to simplify our tech ecosystem, not complicate it. What makes you think DeepData AI is worth considering?",46,262,2026-02-17T17:35:38.181213
6bcb065d-53dc-4918-87d2-6dababea6a0f,4,Seller,"I completely understand your concern about simplifying your tech ecosystem. That's actually one of the benefits of our solution - it can help you streamline your data processing workflows and reduce the number of tools you need to manage. Our solution integrates seamlessly with popular data platforms and tools, and our customer support team is available 24/7 to ensure a smooth onboarding process. I'd like to schedule a follow-up call to discuss how DeepData AI can specifically address your data quality and security concerns, and explore potential integration opportunities with your existing tech stack. Would that be something you'd be open to?",102,651,2026-02-17T17:35:38.181213
25b5ba8e-9561-4eac-a722-7cae10a6dc24,1,Seller,"Hi, my name is Alex and I'm reaching out from DeepData AI. We're a data processing solution that helps companies like yours streamline their workflows and make data-driven decisions. I came across your company and was impressed with the work you're doing with Airtable. Can you tell me a bit more about your current data management processes?",57,342,2026-02-17T17:35:47.509840
25b5ba8e-9561-4eac-a722-7cae10a6dc24,1,Buyer,"(sighs) Ah, another sales call. Look, we're happy with Airtable and it's working well for us. What makes you think we need another solution like DeepData AI? We've already invested a lot of time and resources into building our workflows and apps on Airtable.",44,258,2026-02-17T17:35:47.509840
25b5ba8e-9561-4eac-a722-7cae10a6dc24,2,Seller,"I completely understand your concerns, and I'm not here to replace Airtable. However, I'd like to highlight that DeepData AI is a complementary solution that can help you take your data processing to the next level. Our AI-powered engine can handle large volumes of data, provide real-time insights, and automate tasks that are currently manual. This can help you scale your operations and make more informed decisions. Can I ask, are you experiencing any challenges with data processing or analysis that Airtable isn't fully addressing?",85,537,2026-02-17T17:35:47.509840
25b5ba8e-9561-4eac-a722-7cae10a6dc24,2,Buyer,"(pauses) Honestly, we are struggling with data quality and consistency across our different teams and departments. We have a lot of siloed data, and it's hard to get a unified view of our operations. But I'm not sure if DeepData AI is the right solution for us. How does it integrate with Airtable, and what kind of resources would we need to dedicate to implementing it?",66,371,2026-02-17T17:35:47.509840
25b5ba8e-9561-4eac-a722-7cae10a6dc24,3,Seller,"That's a great question. DeepData AI has a seamless integration with Airtable, and our implementation process is designed to be quick and easy. We've worked with several Airtable customers in the past, and we've developed a robust API that allows for bi-directional data sync. In terms of resources, we typically require a few hours of IT support to set up the integration, and then our customer success team will work closely with your team to ensure a smooth onboarding process. We also offer a free trial, so you can test our solution and see the value it can bring to your organization before committing to a purchase.",107,622,2026-02-17T17:35:47.509840
25b5ba8e-9561-4eac-a722-7cae10a6dc24,3,Buyer,"(skeptical) I'm still not convinced. What kind of ROI can we expect from implementing DeepData AI, and how will it impact our existing workflows and processes? We can't afford to disrupt our operations or add unnecessary complexity to our tech stack.",41,250,2026-02-17T17:35:47.509840
25b5ba8e-9561-4eac-a722-7cae10a6dc24,4,Seller,"I understand your concerns, and I'd be happy to provide some case studies and ROI analysis from our existing customers. On average, our customers see a 30% reduction in data processing time and a 25% increase in data accuracy. In terms of impact on workflows, our solution is designed to be flexible and adaptable, so we can work with your team to ensure a seamless integration that enhances your existing processes rather than disrupting them. Would you be open to a follow-up conversation to discuss this further and explore how DeepData AI can address your specific pain points?",98,581,2026-02-17T17:35:47.509840
209a2034-2e73-43ab-b4e2-c3707ba6c2ce,1,Seller,"Hi, my name is Alex and I'm reaching out from DeepData AI. I came across your company, Palo Alto Networks, and was impressed by your work in cybersecurity protection and software for modern enterprises. I'd love to discuss how our data processing solution can help enhance your security operations.",49,298,2026-02-17T17:35:56.465154
209a2034-2e73-43ab-b4e2-c3707ba6c2ce,1,Buyer,"(skeptical) Ah, another sales call. What makes you think we need your data processing solution? We've just acquired CyberArk and are focusing on redefining identity security for the modern enterprise.",30,200,2026-02-17T17:35:56.465154
