simulation_id,turn_number,speaker,message,word_count,char_count,timestamp
9a073031-db15-4614-a08f-5b669041d8c3,4,Seller,"Absolutely. Our solution can be configured to handle specific routing requirements, and our support team is available 24/7 to ensure a seamless onboarding process. I can also offer to set up a customized demo to show you how DeepData AI can address your specific pain points. Would you be open to a follow-up conversation next week to discuss further?",59,351,2026-02-11T15:29:41.832053
ec093973-3e46-45a2-a37d-042851604772,1,Seller,"Hi, my name is Alex and I'm reaching out from DeepData AI. I came across your company while researching organizations that could benefit from our data processing solution. I saw that your website is currently experiencing technical difficulties, and I wanted to see if our solution could help prevent similar issues in the future.",54,330,2026-02-11T15:29:47.844109
ec093973-3e46-45a2-a37d-042851604772,1,Buyer,"(sighs) Look, I don't have time for this. We're in the middle of resolving a critical issue with our website, and I'm not interested in hearing about some new product or service. What makes you think your solution can even help us?",42,231,2026-02-11T15:29:47.844109
ec093973-3e46-45a2-a37d-042851604772,2,Seller,"I understand that you're busy, and I apologize for the timing. However, our solution, DeepData AI, is specifically designed to help companies like yours process and analyze large amounts of data in real-time, which can help identify and prevent technical issues like the one you're experiencing. We've had success with similar companies in the past, and I'd love to discuss how our solution can help you.",66,404,2026-02-11T15:29:47.844109
ec093973-3e46-45a2-a37d-042851604772,2,Buyer,"(skeptical) I've heard that before. Every vendor claims their solution can solve all our problems. What makes DeepData AI different, and how do I know it's not just another sales pitch?",31,185,2026-02-11T15:29:47.844109
ec093973-3e46-45a2-a37d-042851604772,3,Seller,"That's a fair question. What sets us apart is our proprietary AI-powered engine that can handle massive amounts of data and provide actionable insights in real-time. We've also had success with companies in similar industries, such as XYZ Corporation, where we were able to reduce their downtime by 30% and improve their overall system performance. I'd be happy to provide a case study or set up a demo to show you how our solution can work for your company.",79,458,2026-02-11T15:29:47.844109
ec093973-3e46-45a2-a37d-042851604772,3,Buyer,"(still skeptical) I'm not convinced. We've already invested heavily in our current infrastructure, and I'm not sure I want to rip and replace everything. What kind of ROI can I expect from implementing DeepData AI, and how long would it take to see results?",44,257,2026-02-11T15:29:47.844109
ec093973-3e46-45a2-a37d-042851604772,4,Seller,"I understand your concerns about investment and ROI. Our solution is designed to be flexible and can integrate with your existing infrastructure, so you don't have to start from scratch. In terms of ROI, our average customer sees a return on investment within 6-12 months, with some customers seeing results as soon as 3-4 months. I'd be happy to provide a customized ROI analysis for your company and discuss how we can help you achieve your goals. Would you be open to a follow-up conversation next week to discuss further?",90,525,2026-02-11T15:29:47.844109
be9b60d5-a54e-456f-a413-54b55dc1eec5,1,Seller,"Hi, my name is Alex and I'm reaching out from DeepData AI. We're a data processing solution that helps companies like yours unlock insights from their data. I came across your company and noticed you're using SAP, but I saw that you're experiencing some access issues. Can you tell me a bit more about what's going on with that?",59,328,2026-02-11T15:29:56.395644
be9b60d5-a54e-456f-a413-54b55dc1eec5,1,Buyer,"(sighs) Yeah, we're having some problems with access permissions on our SAP server. But to be honest, I'm not sure how that's relevant to your product. We've got a lot on our plate right now, and I'm not looking to add any new vendors to the mix.",47,246,2026-02-11T15:29:56.395644
be9b60d5-a54e-456f-a413-54b55dc1eec5,2,Seller,"I completely understand your skepticism, but bear with me for a minute. Our solution can actually help alleviate some of the pain points you're experiencing with SAP. By integrating with your existing SAP system, DeepData AI can help you process and analyze large datasets more efficiently, which could potentially reduce the load on your server and mitigate some of those access issues. Have you considered how much time and resources your team is spending on data processing and analysis currently?",80,500,2026-02-11T15:29:56.395644
be9b60d5-a54e-456f-a413-54b55dc1eec5,2,Buyer,"(pauses) Okay, I'll give you that. We do spend a lot of time on data processing. But we've already invested heavily in our SAP system, and I'm not convinced that adding another solution on top of it is the best use of our resources. What makes DeepData AI so special that it's worth the additional cost and complexity?",58,318,2026-02-11T15:29:56.395644
be9b60d5-a54e-456f-a413-54b55dc1eec5,3,Seller,"That's a fair question. What sets us apart is our AI-powered engine that can handle complex data processing tasks at scale, without requiring significant infrastructure upgrades or additional headcount. We've seen companies like yours achieve significant ROI by reducing manual data processing time by up to 70% and improving data accuracy by up to 90%. I'd love to schedule a follow-up conversation to dive deeper into how DeepData AI can address your specific pain points and provide a customized demo. Would you be open to that?",86,531,2026-02-11T15:29:56.395644
be9b60d5-a54e-456f-a413-54b55dc1eec5,3,Buyer,"(hesitates) Okay, fine. I'll give you 30 minutes next week. But I'm warning you, I'm going to be tough to convince. And if this is just a sales pitch, you're wasting your time. I need to see real value and a clear understanding of how this integrates with our existing SAP system.",52,280,2026-02-11T15:29:56.395644
be9b60d5-a54e-456f-a413-54b55dc1eec5,4,Seller,"Absolutely, I understand. I'll make sure to come prepared with specific examples and a tailored demo that speaks to your needs. I'm looking forward to our conversation next week and exploring how DeepData AI can help your team achieve their goals. Thank you for considering our solution, and I'll talk to you soon.",53,314,2026-02-11T15:29:56.395644
aa433b44-1889-433c-837a-e4bff098aead,1,Seller,"Hi, my name is Alex and I'm a Sales Development Representative with DeepData AI. I came across your company while researching innovative organizations in the industry, and I noticed you're currently using Workday for your HR and finance needs. I'd love to explore how our data processing solution can help enhance your existing infrastructure.",54,343,2026-02-11T15:30:03.889125
aa433b44-1889-433c-837a-e4bff098aead,1,Buyer,"(skeptical) Ah, another sales call. What makes you think we need a new data processing solution? We've just implemented Workday and it's handling our HR and finance needs pretty well.",30,183,2026-02-11T15:30:03.889125
aa433b44-1889-433c-837a-e4bff098aead,2,Seller,"That's great to hear that you've implemented Workday! Our solution, DeepData AI, is actually designed to complement existing ERPs like Workday. We help organizations like yours unlock more value from their data by providing advanced analytics and insights. With DeepData AI, you can automate data processing, reduce manual errors, and gain a more comprehensive understanding of your business performance.",59,404,2026-02-11T15:30:03.889125
aa433b44-1889-433c-837a-e4bff098aead,2,Buyer,"(objection) I'm not sure we need another system to manage. We've just finished implementing Workday, and now you're telling me we need to add another layer of complexity to our tech stack? How does DeepData AI integrate with Workday, and what's the ROI on this investment?",46,272,2026-02-11T15:30:03.889125
aa433b44-1889-433c-837a-e4bff098aead,3,Seller,"I completely understand your concerns about adding complexity. DeepData AI is designed to be a seamless integration with Workday, and our implementation process is relatively quick – typically taking only a few weeks. In terms of ROI, our customers have seen an average reduction of 30% in manual data processing errors and a 25% increase in data-driven decision-making. We've also had customers realize significant cost savings by automating data processing tasks. I'd be happy to provide some case studies and examples of how our solution has helped similar organizations.",89,574,2026-02-11T15:30:03.889125
aa433b44-1889-433c-837a-e4bff098aead,3,Buyer,"(still skeptical) Okay, I'll listen. But I need to see some concrete evidence that this solution will work for us. Can you share some specific use cases or success stories from companies similar to ours? And what kind of support do you offer to ensure a smooth implementation and ongoing usage?",51,294,2026-02-11T15:30:03.889125
aa433b44-1889-433c-837a-e4bff098aead,4,Seller,"Absolutely. I can share a case study from a company in your industry that saw a 40% reduction in data processing time and a 20% increase in finance team productivity after implementing DeepData AI. We also offer comprehensive support, including dedicated implementation specialists, ongoing training, and 24/7 customer support. I'd be happy to set up a follow-up call to discuss this further and answer any additional questions you may have. Would you be available for a call next week?",79,486,2026-02-11T15:30:03.889125
00ee0e8c-e04c-4a8d-bd35-f79164cf4f8c,1,Seller,"Hi, my name is Alex and I'm reaching out from DeepData AI. We're a company that specializes in data processing solutions. I came across your company and noticed that you're using Tableau for data visualization, but I saw that you're experiencing some access issues with their website. I was wondering if you're experiencing any similar issues with your internal data management.",61,378,2026-02-11T15:30:20.494219
00ee0e8c-e04c-4a8d-bd35-f79164cf4f8c,1,Buyer,"(sighs) Yeah, we're having some trouble with accessing Tableau's site, but that's not really a concern for me right now. We've got more pressing issues to deal with. What makes you think we need a data processing solution like DeepData AI?",41,239,2026-02-11T15:30:20.494219
00ee0e8c-e04c-4a8d-bd35-f79164cf4f8c,2,Seller,"Well, from my research, it seems like your company is dealing with a large amount of data from various sources. Our solution can help you streamline your data management process, reduce errors, and increase efficiency. We've worked with similar companies in the past and have seen significant improvements in their data analysis capabilities. I'd love to schedule a demo to show you how DeepData AI can help.",67,408,2026-02-11T15:30:20.494219
00ee0e8c-e04c-4a8d-bd35-f79164cf4f8c,2,Buyer,"(skeptical) I'm not sure we need another data processing solution. We've already invested a lot in our current infrastructure, and I'm not convinced that DeepData AI can offer anything significantly better. What sets you apart from other solutions on the market?",41,262,2026-02-11T15:30:20.494219
00ee0e8c-e04c-4a8d-bd35-f79164cf4f8c,3,Seller,"That's a fair question. Our AI-powered engine is able to handle large volumes of data much faster and more accurately than traditional solutions. We've also developed a proprietary algorithm that can identify and fix data quality issues in real-time, which can save your team a significant amount of time and resources. Additionally, our solution is highly scalable and can integrate seamlessly with your existing infrastructure, including Tableau.",67,448,2026-02-11T15:30:20.494219
00ee0e8c-e04c-4a8d-bd35-f79164cf4f8c,3,Buyer,"(still skeptical) I'll be honest, I'm not impressed by buzzwords like ""AI-powered"" and ""proprietary algorithm"". Can you give me some concrete numbers on how DeepData AI has helped other companies in terms of cost savings or efficiency gains? And what kind of support and training do you offer to ensure a smooth implementation?",53,327,2026-02-11T15:30:20.494219
efe37eed-e9d4-41fe-a14d-2354da16b643,1,Seller,"Hi, my name is Alex and I'm a representative from DeepData AI. I came across your company while researching innovative enterprises in the data and AI space. I noticed you're currently using Databricks, and I'd love to explore how our solution can complement and enhance your existing data processing capabilities.",50,313,2026-02-11T15:30:26.955035
efe37eed-e9d4-41fe-a14d-2354da16b643,1,Buyer,"(skeptical) Ah, another data processing solution. What makes DeepData AI so special? We've already invested heavily in Databricks, and I'm not sure we're looking to add another tool to our stack.",31,195,2026-02-11T15:30:26.955035
efe37eed-e9d4-41fe-a14d-2354da16b643,2,Seller,"I completely understand your skepticism, and I appreciate your investment in Databricks. However, our solution is designed to work in tandem with existing platforms like Databricks, helping to optimize data processing and reduce costs. We've seen significant success with similar companies, where our solution has improved data quality and reduced processing time by up to 30%. I'd love to discuss how DeepData AI can help you unlock more value from your data.",72,460,2026-02-11T15:30:26.955035
efe37eed-e9d4-41fe-a14d-2354da16b643,2,Buyer,"(still skeptical) That sounds like a lot of marketing fluff. How does your solution actually work, and what specific benefits can you offer that Databricks can't? We're already using their AI-powered tools to build and deploy models, so I'm not sure what gap you're trying to fill.",47,281,2026-02-11T15:30:26.955035
efe37eed-e9d4-41fe-a14d-2354da16b643,3,Seller,"I understand your concerns, and I'm happy to provide more specifics. DeepData AI uses a proprietary algorithm to identify and eliminate data duplicates, inconsistencies, and errors, resulting in higher-quality data for your models. This, in turn, can improve model accuracy and reduce the risk of biased outcomes. While Databricks is excellent for building and deploying models, our solution focuses on the critical data preparation step, which is often the most time-consuming and labor-intensive part of the process. By integrating DeepData AI with your existing Databricks workflow, you can streamline your data processing and free up more resources for model development and deployment.",102,690,2026-02-11T15:30:26.955035
efe37eed-e9d4-41fe-a14d-2354da16b643,3,Buyer,"(somewhat intrigued) I see. So, you're saying that DeepData AI can help us improve our data quality and reduce the time spent on data preparation. That's definitely an area where we're struggling. But what about the cost? We're on a tight budget, and I'm not sure we can justify adding another expense to our tech stack.",56,320,2026-02-11T15:30:26.955035
efe37eed-e9d4-41fe-a14d-2354da16b643,4,Seller,"I completely understand budget constraints, and I'd be happy to discuss pricing and ROI with you. We've worked with several companies in similar situations, and our solution has consistently delivered significant cost savings and efficiency gains. In fact, one of our clients was able to reduce their data processing costs by 25% after implementing DeepData AI. I'd love to set up a follow-up conversation to explore how our solution can help you achieve similar results and discuss pricing options that fit your budget. Would you be open to a demo and further discussion?",93,572,2026-02-11T15:30:26.955035
b88740d4-5689-45d0-8242-b89cd2166a9e,1,Seller,"Hi, my name is Alex, and I'm a Sales Development Representative from DeepData AI. I came across your company while researching industry leaders in the tech space, and I noticed that you're currently using Splunk for your security and observability needs. Can you tell me a bit about your experience with Splunk so far?",54,318,2026-02-11T15:30:33.594139
b88740d4-5689-45d0-8242-b89cd2166a9e,1,Buyer,"Ah, yeah. We've been using Splunk for a while now, and it's been...adequate. But to be honest, we're still struggling to get the most out of our machine data. We're generating terabytes of data every day, but it's hard to make sense of it all. What makes you think DeepData AI can help us with that?",56,299,2026-02-11T15:30:33.594139
b88740d4-5689-45d0-8242-b89cd2166a9e,2,Seller,"That's exactly where DeepData AI comes in. Our solution is designed to help companies like yours unlock the hidden value in their machine data. We use advanced AI and ML algorithms to process and analyze large datasets, providing real-time insights and recommendations that can help you improve your security posture, reduce costs, and drive business growth. And the best part is, our solution integrates seamlessly with Splunk, so you can continue to use the tools you're familiar with while still getting the most out of your data.",87,533,2026-02-11T15:30:33.594139
b88740d4-5689-45d0-8242-b89cd2166a9e,2,Buyer,"I'm not sure I'm convinced. We've already invested heavily in Splunk, and I'm not looking to add another tool to our stack. What makes DeepData AI so different from what we're already using? And how do I know it's going to be worth the cost?",45,241,2026-02-11T15:30:33.594139
b88740d4-5689-45d0-8242-b89cd2166a9e,3,Seller,"That's a fair question. While Splunk is a great tool for security and observability, it's primarily focused on monitoring and troubleshooting. DeepData AI takes it a step further by using AI to analyze and provide recommendations on how to improve your overall data strategy. Our solution can help you identify areas where you can reduce costs, improve efficiency, and even drive new revenue streams. And as for the cost, we've worked with numerous companies in the past who have seen significant ROI within the first few months of implementation. I'd be happy to provide some case studies and examples if you're interested.",102,624,2026-02-11T15:30:33.594139
b88740d4-5689-45d0-8242-b89cd2166a9e,3,Buyer,"Okay, I'm willing to listen. But I need to see some concrete numbers and examples before I'll even consider bringing this to our leadership team. Can you send me some information on how DeepData AI has helped similar companies in the past? And what kind of support and resources do you offer to ensure a smooth implementation process?",58,334,2026-02-11T15:30:33.594139
b88740d4-5689-45d0-8242-b89cd2166a9e,4,Seller,"Absolutely. I can send over some case studies and examples of how DeepData AI has helped companies in similar industries. We also offer a comprehensive onboarding process, including dedicated support and training, to ensure that you get the most out of our solution. And if you're interested, we can even set up a demo to show you exactly how DeepData AI can help you unlock the hidden value in your machine data. Would you be available for a follow-up call next week to discuss further?",85,487,2026-02-11T15:30:33.594139
bab4f4d9-cd0f-42ec-bf77-57dc88a3ad6c,1,Seller,"Hi, my name is Alex and I'm reaching out from DeepData AI. We're a data processing solution that helps companies like yours unlock insights from their customer data. I saw that Twilio is a leader in CPaaS and I was wondering if you're currently using any data processing solutions to enhance your customer engagement platform?",55,326,2026-02-11T15:30:40.360892
bab4f4d9-cd0f-42ec-bf77-57dc88a3ad6c,1,Buyer,"Ah, yes. We're currently using a combination of in-house tools and third-party providers to manage our customer data. But to be honest, I'm not convinced that we need another data processing solution. What makes DeepData AI so special?",38,235,2026-02-11T15:30:40.360892
bab4f4d9-cd0f-42ec-bf77-57dc88a3ad6c,2,Seller,"That's a fair question. Our solution uses AI-powered algorithms to process large amounts of customer data in real-time, providing actionable insights that can help you personalize your customer experiences. We've seen significant ROI for our clients, including a 25% increase in customer retention. I'd love to schedule a demo to show you how it works. Would you be open to that?",61,379,2026-02-11T15:30:40.360892
bab4f4d9-cd0f-42ec-bf77-57dc88a3ad6c,2,Buyer,"I'm not sure. We've tried other data processing solutions in the past and they've been a nightmare to integrate with our existing systems. How does DeepData AI handle integration, and what kind of support do you offer?",37,218,2026-02-11T15:30:40.360892
bab4f4d9-cd0f-42ec-bf77-57dc88a3ad6c,3,Seller,"I completely understand your concerns. Our solution is designed to be highly flexible and can integrate with a wide range of systems, including Twilio's Customer Engagement platform. We also offer dedicated support and a comprehensive onboarding process to ensure a seamless integration. In fact, we've already integrated with several Twilio customers, including Beehiiv and Instacart, and they've seen significant benefits from our solution.",63,442,2026-02-11T15:30:40.360892
bab4f4d9-cd0f-42ec-bf77-57dc88a3ad6c,3,Buyer,"Okay, I'm intrigued. But what about data security? We handle sensitive customer data and I need to ensure that any solution we implement meets our strict security standards. Can you walk me through your security protocols?",36,222,2026-02-11T15:30:40.360892
bab4f4d9-cd0f-42ec-bf77-57dc88a3ad6c,4,Seller,"Absolutely. Data security is our top priority at DeepData AI. We're fully compliant with all major data regulations, including GDPR and CCPA, and our solution is built with enterprise-grade security features, including end-to-end encryption and access controls. We've also undergone rigorous security audits and testing to ensure the integrity of our solution. I can provide you with a detailed security whitepaper and introduce you to our security team if you'd like.",71,468,2026-02-11T15:30:40.360892
05c7d30c-9310-42ac-9a00-20a539372c54,1,Seller,"Hi, my name is Alex and I'm reaching out from DeepData AI. We're a data processing solution that helps companies like yours optimize their data workflows and make better decisions. Can you tell me a little bit about your current data management process?",43,253,2026-02-11T15:30:47.077501
05c7d30c-9310-42ac-9a00-20a539372c54,1,Buyer,"(sighs) Look, I don't have a lot of time for this. We're already using a number of different tools to manage our data, including Docusign for electronic signatures. What makes DeepData AI so special that I should care?",38,218,2026-02-11T15:30:47.077501
05c7d30c-9310-42ac-9a00-20a539372c54,2,Seller,"I completely understand that you're busy, and I appreciate you taking the time to speak with me. Our solution is unique in that it can handle large volumes of data from multiple sources, and provide real-time insights and analytics. We've seen companies reduce their data processing time by up to 70% and improve their decision-making capabilities as a result. I'd love to schedule a demo to show you how it works.",71,414,2026-02-11T15:30:47.077501
05c7d30c-9310-42ac-9a00-20a539372c54,2,Buyer,"(skeptical) 70% reduction in processing time sounds like a pretty bold claim. How do you plan on integrating with our existing systems, including Docusign? We've invested a lot in our current infrastructure and I'm not looking to rip and replace anything.",41,255,2026-02-11T15:30:47.077501
05c7d30c-9310-42ac-9a00-20a539372c54,3,Seller,"That's completely understandable. Our solution is designed to be highly integratable, and we have pre-built connectors for a number of popular tools, including Docusign. We can also work with your team to build custom integrations if needed. In terms of the 70% reduction in processing time, I can provide case studies and references from existing customers who have seen similar results. Would you be open to a follow-up conversation to discuss further?",72,454,2026-02-11T15:30:47.077501
05c7d30c-9310-42ac-9a00-20a539372c54,3,Buyer,"(still skeptical) I suppose it couldn't hurt to learn more. But I need to be clear: we're not looking to add any new vendors or solutions to our stack unless it's going to have a significant impact on our business. What kind of ROI can I expect from implementing DeepData AI, and what's the typical implementation timeline look like?",59,333,2026-02-11T15:30:47.077501
cd370073-2cee-4092-ad55-fa8445a1986a,1,Seller,"Hi, this is Alex from DeepData AI. I noticed your company is scaling fast—are you currently struggling with data processing costs?",21,130,2026-02-16T12:45:52.762621
cd370073-2cee-4092-ad55-fa8445a1986a,1,Buyer,"""We've indeed been scaling rapidly, but I'm not convinced that your solution would be cost-effective for us, especially considering the hefty price tags I've seen from similar AI-powered data processing vendors. Can you tell me what sets DeepData AI apart from competitors like Google Cloud or AWS, and how you plan to justify the investment?""",55,343,2026-02-16T12:45:52.762621
cd370073-2cee-4092-ad55-fa8445a1986a,2,Seller,"I completely understand your concern about cost-effectiveness, but what sets DeepData AI apart is our proprietary AI engine that can reduce data processing costs by up to 30% while increasing processing speeds by 5x, allowing our customers to scale efficiently without breaking the bank. I'd love to schedule a meeting to walk you through a customized ROI analysis and demonstrate how DeepData AI can specifically address your company's unique data processing challenges.",72,471,2026-02-16T12:45:52.762621
