simulation_id,turn_number,speaker,message,word_count,char_count,timestamp
804b9ee8-0cb1-4a1c-8436-86c24ea9706c,4,Seller,"How about next Wednesday at 2 PM? I'll make sure to have one of our technical experts on the call to answer any questions you may have and provide a personalized walkthrough of our solution. And I want to assure you, we'll work closely with your team to ensure a smooth integration process and provide ongoing support to ensure you're getting the most out of our solution.",67,372,2026-02-17T17:36:04.294655
21970d15-e9af-4edd-b341-dbdf7eec3c33,1,Seller,"Hi, my name is Alex and I'm reaching out from DeepData AI. We're a data processing solution that helps companies like yours streamline their workflows and unlock insights from their data. I saw that your company is using Zapier for automation, and I think our solution could be a great complement to that.",53,305,2026-02-17T17:44:46.104303
21970d15-e9af-4edd-b341-dbdf7eec3c33,1,Buyer,"(sighing) Another sales call. What makes you think we need another data processing solution? We're already using Zapier for automation, and it's working out pretty well for us.",28,176,2026-02-17T17:44:46.104303
21970d15-e9af-4edd-b341-dbdf7eec3c33,2,Seller,"I completely understand your skepticism, but I'd like to highlight that while Zapier is great for automation, it's not necessarily optimized for deep data analysis. Our solution, DeepData AI, is specifically designed to handle large datasets and provide advanced analytics capabilities that can help you uncover new insights and opportunities. For example, we've worked with companies like Toyota of Orlando, who were able to manage over 30,000 lead records and save 20+ hours weekly with our solution.",77,502,2026-02-17T17:44:46.104303
21970d15-e9af-4edd-b341-dbdf7eec3c33,2,Buyer,"(still skeptical) I'm not sure I buy that. We've already invested a lot in Zapier, and I'm not convinced that we need to add another tool to the mix. What makes you think your solution is worth the additional cost and complexity?",42,229,2026-02-17T17:44:46.104303
21970d15-e9af-4edd-b341-dbdf7eec3c33,3,Seller,"I understand your concerns about cost and complexity, but I'd like to address those directly. Our solution is designed to be highly scalable and flexible, so it can grow with your company's needs. Additionally, we offer a free trial and a tiered pricing model, so you can start small and scale up as needed. In terms of ROI, our customers have seen significant benefits, such as the $1 million increase in potential revenue that Jacob Sirrs from Marketing Operations saw after implementing our solution.",84,503,2026-02-17T17:44:46.104303
21970d15-e9af-4edd-b341-dbdf7eec3c33,3,Buyer,"(somewhat intrigued) Okay, I'll give you a few minutes more. But can you walk me through a specific example of how DeepData AI would integrate with our existing Zapier setup, and what kind of benefits we could expect to see?",40,224,2026-02-17T17:44:46.104303
21970d15-e9af-4edd-b341-dbdf7eec3c33,4,Seller,"Absolutely. Let me give you an example. One of our customers, a marketing agency, was using Zapier to automate their lead generation process, but they were struggling to analyze the large amounts of data they were collecting. We integrated DeepData AI with their Zapier setup, and they were able to gain deeper insights into their customer behavior and preferences. As a result, they were able to optimize their marketing campaigns and see a significant increase in conversions. I'd be happy to set up a demo to show you how this could work for your company.",95,558,2026-02-17T17:44:46.104303
21970d15-e9af-4edd-b341-dbdf7eec3c33,4,Buyer,"(thoughtfully) Okay, I think I'd like to see that demo. But I have to warn you, we're a pretty technical team, so you'll need to be prepared to answer some tough questions about your solution and how it integrates with Zapier.",41,226,2026-02-17T17:44:46.104303
a92a1b42-fb0a-4e10-8394-bba3dba3738c,1,Seller,"Hi, my name is Alex and I'm reaching out from DeepData AI. We're a data processing solution that helps companies like yours optimize their data infrastructure. I came across your company while researching potential clients and noticed that you're currently experiencing some issues with your Linode hosting, specifically with the 403 Forbidden error. Can you tell me a little bit about what's going on with that?",66,412,2026-02-19T15:56:02.873868
a92a1b42-fb0a-4e10-8394-bba3dba3738c,1,Buyer,"(sighs) Yeah, we're having some issues with access permissions. It's been a bit of a headache, but I'm not sure it's related to our data processing needs. What makes you think DeepData AI can help us with that?",38,210,2026-02-19T15:56:02.873868
a92a1b42-fb0a-4e10-8394-bba3dba3738c,2,Seller,"Well, our solution is designed to integrate with various cloud hosting platforms, including Linode, to streamline data access and processing. We've had success with similar companies in resolving permission issues and improving overall data efficiency. I'd love to discuss how our solution can address your specific pain points. Would you be open to a quick demo to explore how DeepData AI can help?",63,399,2026-02-19T15:56:02.873868
a92a1b42-fb0a-4e10-8394-bba3dba3738c,2,Buyer,"I'm not sure. We're currently locked into a contract with another data processing vendor, and I'm not authorized to make any changes to our current setup. Plus, I'm not convinced that your solution is worth the potential cost and integration effort. What makes DeepData AI so special that it's worth considering a switch?",53,321,2026-02-19T15:56:02.873868
a92a1b42-fb0a-4e10-8394-bba3dba3738c,3,Seller,"I understand your concerns, and I appreciate your honesty. DeepData AI offers advanced AI-driven insights and automation capabilities that can significantly reduce your data processing costs and improve data quality. We've seen companies achieve up to 30% cost savings and 25% increase in data processing speed. However, I understand that switching vendors can be a complex process. If I could offer you a customized demo tailored to your specific use case, would that be something you'd be willing to consider?",80,511,2026-02-19T15:56:02.873868
a92a1b42-fb0a-4e10-8394-bba3dba3738c,3,Buyer,"(firmly) Look, I appreciate the offer, but like I said, we're not looking to make any changes to our current setup right now. We're focused on resolving the immediate issues with our Linode hosting, and exploring new data processing solutions isn't a priority for us at this time. I think we'll have to pass on the demo.",57,320,2026-02-19T15:56:02.873868
a92a1b42-fb0a-4e10-8394-bba3dba3738c,4,Seller,"I completely understand, and I appreciate your time today. If you're willing, I'd like to send you some information about DeepData AI and check in with you in a few months to see if your priorities have shifted.",38,211,2026-02-19T15:56:02.873868
a92a1b42-fb0a-4e10-8394-bba3dba3738c,4,Buyer,"No, that's okay. I think we're good. We'll stick with our current solution for now. Thanks for reaching out, though.",20,116,2026-02-19T15:56:02.873868
e73b0d5d-091b-45f7-8427-40ea18c9b720,1,Seller,"Hi, my name is Alex and I'm reaching out from DeepData AI. I came across your company and noticed that you're experiencing some technical difficulties with your website. I understand that's not ideal, especially when it comes to handling large amounts of data. Our solution helps companies like yours process and manage their data more efficiently. Can I ask, are you currently using any data processing solutions?",67,414,2026-02-19T16:07:50.572974
e73b0d5d-091b-45f7-8427-40ea18c9b720,1,Buyer,"(sighs) Look, we're in the middle of trying to resolve this Oracle issue. I don't have time to talk about new solutions right now. We've already got a team working on it and I'm not sure we need anything else.",40,209,2026-02-19T16:07:50.572974
e73b0d5d-091b-45f7-8427-40ea18c9b720,2,Seller,"I completely understand the urgency of resolving your current issue. However, our solution, DeepData AI, is designed to prevent such issues from happening in the future by providing real-time data processing and analytics. It might be worth exploring once you've resolved your immediate problem. Would you be open to a quick discussion on how it could benefit your company in the long run?",63,389,2026-02-19T16:07:50.572974
e73b0d5d-091b-45f7-8427-40ea18c9b720,2,Buyer,"(firmly) I appreciate the offer, but we've already invested heavily in Oracle. I'm not sure we're looking to add another vendor to our stack, especially not right now. Our priority is getting our site back up and running smoothly.",39,230,2026-02-19T16:07:50.572974
e73b0d5d-091b-45f7-8427-40ea18c9b720,3,Seller,"I understand your commitment to Oracle, and our solution can actually complement your existing infrastructure. It's designed to work with various data systems, including Oracle. I'd love to show you how it can enhance your data management capabilities without replacing what you already have. Would you consider a demo once your immediate issues are resolved?",55,359,2026-02-19T16:07:50.572974
e73b0d5d-091b-45f7-8427-40ea18c9b720,3,Buyer,"(polite but firm) Thank you for the offer, but I think we'll have to pass. We're not looking to add any new solutions at this time, and even if we were, I'm not the right person to make that decision. You should reach out to our procurement department, but honestly, I wouldn't hold out much hope.",56,297,2026-02-19T16:07:50.572974
e73b0d5d-091b-45f7-8427-40ea18c9b720,4,Seller,"I understand, and I appreciate your honesty. If our paths cross again in the future, perhaps we can discuss further. In the meantime, I wish you the best of luck in resolving your current technical issues.",36,205,2026-02-19T16:07:50.572974
e73b0d5d-091b-45f7-8427-40ea18c9b720,4,Buyer,"Thank you, but we're not interested in DeepData AI at this time. Please don't follow up.",16,88,2026-02-19T16:07:50.572974
7da5cbf8-a422-4116-b00b-976464643ad2,1,Seller,"Hi Alex, this is Sarah from DeepData AI. I know you're busy, so I'll be brief. I'm reaching out because we help companies like Innovatech significantly reduce their data processing costs and improve analytical speeds by up to 30%. Have you ever found your current data infrastructure to be a bottleneck for your innovation?",54,323,2026-02-19T16:07:53.100825
7da5cbf8-a422-4116-b00b-976464643ad2,1,Buyer,"Sarah, I appreciate the directness, but honestly, we're not looking to change our data processing solutions right now. We've invested heavily in our current stack, and it's performing adequately for our needs.",32,209,2026-02-19T16:07:53.100825
7da5cbf8-a422-4116-b00b-976464643ad2,2,Seller,"I understand completely, Alex. Many CTOs we speak with have similar sentiments. Could I ask what specific solutions you're currently using or what your primary data processing challenges are that you *do* feel are adequately addressed? We often find companies have specific areas that, even with existing solutions, are still ripe for optimization.",53,348,2026-02-19T16:07:53.100825
7da5cbf8-a422-4116-b00b-976464643ad2,2,Buyer,"Look, we're using a combination of cloud-native tools and some in-house development. It's complex, yes, but it works. And to be blunt, ""improving analytical speeds by 30%"" sounds like a marketing slogan. We've heard it all before from vendors.",39,243,2026-02-19T16:07:53.100825
7da5cbf8-a422-4116-b00b-976464643ad2,3,Seller,"That's a fair point about marketing speak. We try to back that up with concrete case studies, like how we helped a SaaS company in a similar industry reduce their ETL processing times from 8 hours to 2 hours, saving them over $100k annually. It's less about replacing your entire infrastructure and more about intelligent optimization of specific workloads.",59,357,2026-02-19T16:07:53.100825
7da5cbf8-a422-4116-b00b-976464643ad2,3,Buyer,"Savings are always interesting, but our current budget cycles are set, and we're locked into several long-term agreements with our providers. Even if there's potential for optimization, the overhead of exploring and integrating a new solution just isn't a priority for us at this moment.",45,287,2026-02-19T16:07:53.100825
7da5cbf8-a422-4116-b00b-976464643ad2,4,Buyer,"Sarah, I've heard your points, but frankly, we're not exploring new data processing solutions at this time. Our current architecture is stable, and we're not looking for additional vendors or integrations. Please respect that.",34,226,2026-02-19T16:07:53.100825
6ac132c6-20f1-4f77-ba73-1222175bd6b5,1,Seller,"Hi [CTO Name], this is Alex from DeepData AI. I know you're busy, but I wanted to quickly touch base regarding Vultr's focus on AI infrastructure, specifically your GPU offerings. We've seen many companies leveraging powerful GPUs like the NVIDIA HGX B200 to accelerate their data processing, and at DeepData AI, we specialize in optimizing that exact process for companies like yours.",62,385,2026-02-19T16:08:12.365011
6ac132c6-20f1-4f77-ba73-1222175bd6b5,1,Buyer,"Alex, thanks for the call. We're definitely investing in AI infrastructure, but ""optimizing data processing"" is a pretty broad statement. What exactly does DeepData AI do that Vultr's native tools or existing solutions don't already cover?",36,239,2026-02-19T16:08:12.365011
6ac132c6-20f1-4f77-ba73-1222175bd6b5,2,Seller,"That's a fair question. Vultr provides the incredible hardware foundation, and you've got a fantastic selection of GPUs. However, many of our clients find that getting the most out of that hardware for complex AI data pipelines – think pre-processing, feature engineering, and efficient data loading into training models – requires specialized software. DeepData AI automates and accelerates these stages, often reducing processing times by 30-50% and freeing up your expensive GPU resources for actual model training.",77,518,2026-02-19T16:08:12.365011
6ac132c6-20f1-4f77-ba73-1222175bd6b5,2,Buyer,"30-50% is a big claim. We've looked into various data acceleration solutions before, and honestly, the integration hassle and cost often outweigh the perceived benefits. We're pretty comfortable with our current workflow, and the thought of introducing another complex layer into our system… it’s not exactly a top priority right now.",51,334,2026-02-19T16:08:12.365011
6ac132c6-20f1-4f77-ba73-1222175bd6b5,3,Seller,"I completely understand your hesitation about integration and complexity. That’s precisely where DeepData AI shines. We’re designed for seamless integration, often requiring minimal code changes, and our platform is built with an intuitive UI for easier management. We’ve found that for organizations heavily reliant on GPU compute, like those using Vultr’s advanced offerings, the ROI in terms of faster time-to-insight and reduced infrastructure idle time quickly justifies the investment. Perhaps a quick, focused 15-minute demo could illustrate how we specifically address your current data processing bottlenecks?",86,618,2026-02-19T16:08:12.365011
6ac132c6-20f1-4f77-ba73-1222175bd6b5,3,Buyer,"Look, Alex, I appreciate you trying, but we're happy with our current setup. We've got internal teams working on optimizing our data pipelines, and frankly, we're in the middle of evaluating several other vendor proposals for different areas of our cloud infrastructure. DeepData AI isn't on our radar for immediate consideration.",51,330,2026-02-19T16:08:12.365011
6ac132c6-20f1-4f77-ba73-1222175bd6b5,4,Buyer,"We're not interested right now. We've already got a solution in place for our data processing needs, and it’s working well for us. Please feel free to send over an email with some more information, and we can review it if our needs change in the future.",47,253,2026-02-19T16:08:12.365011
08b7a213-5d8d-4ff8-80f1-74334e11857d,1,Seller,"Hi [CTO Name], my name is Alex from DeepData AI. I was doing some research on [Company Name] and was really impressed by your focus on providing robust hosting solutions from Germany. I wanted to reach out because we help companies like yours optimize their data processing pipelines, especially with the increasing volume and complexity of customer data that comes with scaling. Have you found that managing and extracting insights from your growing data streams has become a significant challenge?",80,499,2026-02-19T16:08:29.165333
08b7a213-5d8d-4ff8-80f1-74334e11857d,1,Buyer,"Alex, thanks for the call, but honestly, we’re swamped. We’ve got our infrastructure running smoothly, and frankly, data processing isn't really a burning issue for us right now. We handle what we need to internally.",35,216,2026-02-19T16:08:29.165333
08b7a213-5d8d-4ff8-80f1-74334e11857d,2,Seller,"I understand you're busy, [CTO Name], and it's great that your infrastructure is performing well. What I'm hearing from many hosting providers is that while the infrastructure is solid, the manual effort and time spent on analyzing customer usage patterns, optimizing server allocation based on real-time data, or even predictive maintenance can really eat into valuable engineering hours. Are you currently dedicating significant resources to that kind of granular data analysis?",71,480,2026-02-19T16:08:29.165333
08b7a213-5d8d-4ff8-80f1-74334e11857d,2,Buyer,"We have our internal tools. They do the job. And to be frank, we’ve looked at AI solutions before, and they tend to be incredibly complex and expensive to integrate. We don't have the budget or the appetite for a major overhaul right now. Our current setup is cost-effective.",49,275,2026-02-19T16:08:29.165333
08b7a213-5d8d-4ff8-80f1-74334e11857d,3,Seller,"That's a very valid concern. We often hear that integrating new technologies can be a hurdle. What sets DeepData AI apart is our focus on seamless integration with existing systems, and our pricing model is designed to be significantly more cost-effective than traditional, on-premise solutions, especially when you factor in the engineering time saved. We can typically show tangible ROI within the first few months by automating tasks that would otherwise require multiple engineers.",74,485,2026-02-19T16:08:29.165333
08b7a213-5d8d-4ff8-80f1-74334e11857d,3,Buyer,"Look, Alex, I appreciate you explaining it. But we’re happy with our current process. We have a good handle on our data, and the cost savings you’re mentioning don't quite align with what we're seeing as our priorities. We're not looking to change anything in that area.",47,270,2026-02-19T16:08:29.165333
08b7a213-5d8d-4ff8-80f1-74334e11857d,4,Buyer,"No, thank you, Alex. We're not interested in exploring this further at this time.",14,81,2026-02-19T16:08:29.165333
ec7a2c5e-8df4-4b3c-9402-5d449fac19b0,1,Seller,"Hello Mr. Sharma, this is Anya from DeepData AI. I’m calling to briefly introduce a solution that’s helping companies like yours in India optimize their data processing for AI workloads.",30,186,2026-02-19T16:08:45.652747
ec7a2c5e-8df4-4b3c-9402-5d449fac19b0,1,Buyer,"Anya, thanks for the call. I’m actually quite busy. We’re with OVHcloud India and we’ve just launched some new compute instances and object storage in Mumbai. What exactly do you do?",31,182,2026-02-19T16:08:45.652747
ec7a2c5e-8df4-4b3c-9402-5d449fac19b0,2,Seller,"That’s fantastic about the new offerings, Mr. Sharma. We help companies leverage their existing data more effectively for AI and machine learning. Essentially, we accelerate the entire data pipeline, from ingestion to processing, significantly reducing time-to-insight and operational costs. Given your focus on compute and storage, I imagine data processing is a core concern.",54,377,2026-02-19T16:08:45.652747
ec7a2c5e-8df4-4b3c-9402-5d449fac19b0,2,Buyer,"Data processing is a part of it, sure. But we’re already running a pretty robust infrastructure. We have dedicated servers, managed Kubernetes, and object storage. What makes your solution different, and frankly, why should I even consider adding another layer to our stack?",43,274,2026-02-19T16:08:45.652747
ec7a2c5e-8df4-4b3c-9402-5d449fac19b0,3,Seller,"That’s a fair question, Mr. Sharma. Many of our clients are already on platforms like OVHcloud, and they find our solution complements their existing infrastructure rather than replacing it. We specialize in the *intelligence* layer of data processing – think advanced feature engineering, anomaly detection within datasets, and even predictive analytics, all automated. For instance, clients using our platform have seen a 30-40% reduction in data preparation time for their ML models, which can be a huge bottleneck. We also offer a unique price-to-performance ratio that’s hard to match.",89,590,2026-02-19T16:08:45.652747
ec7a2c5e-8df4-4b3c-9402-5d449fac19b0,3,Buyer,"30-40% reduction? That sounds ambitious. We’ve got a team of data engineers working on this. What’s the integration like with our current setup? And honestly, what’s the price point we’re looking at? We’re very price-sensitive, as you can see from our own promotions.",43,267,2026-02-19T16:08:45.652747
ec7a2c5e-8df4-4b3c-9402-5d449fac19b0,4,Seller,"Integration is designed to be seamless, Mr. Sharma. We offer connectors for S3-compatible storage, and we can integrate with your existing compute clusters. Regarding pricing, it's a usage-based model that's very transparent and scalable. We actually have a free trial available with ₹18,000 in credits, similar to your public cloud credits, which would allow you to test our capabilities on your own data without any upfront commitment. I’d love to schedule a quick 15-minute demo to show you exactly how we achieve those reductions and how it would fit into your environment.",92,577,2026-02-19T16:08:45.652747
ec7a2c5e-8df4-4b3c-9402-5d449fac19b0,4,Buyer,"Look, Anya, I appreciate the offer and the free credit is interesting, but we’re heads down on rolling out these new compute instances and getting our managed Kubernetes offering polished for the Indian market. Data processing optimization isn't a priority for us *right now*. Perhaps sometime down the line. Please send me an email with the details, and my team can review it.",63,377,2026-02-19T16:08:45.652747
26961341-5272-4df8-8bc0-e8599da94e7a,1,Seller,"Hi, is this [CTO Name]? My name is Alex from DeepData AI. I'm calling because I saw F5 NGINX's recent TrustRadius Top Rated award, and it got me thinking about how companies like yours are managing the sheer volume of data generated by modern application architectures. We help CTOs streamline their data processing pipelines to accelerate insights.",57,349,2026-02-19T16:09:03.093494
26961341-5272-4df8-8bc0-e8599da94e7a,1,Buyer,"Alex, thanks for the call. I'm swamped today. What specifically about our data processing are you concerned with? We have a pretty robust infrastructure with NGINX One and our Azure/GCP deployments.",31,198,2026-02-19T16:09:03.093494
26961341-5272-4df8-8bc0-e8599da94e7a,2,Seller,"I understand you're busy, [CTO Name]. My aim isn't to re-architect your current setup, but rather to see if there are any hidden bottlenecks or inefficiencies in how you're processing the telemetry, logs, and user data that your applications are producing. For instance, are your teams spending a lot of time on manual data preparation before they can even start extracting value?",62,380,2026-02-19T16:09:03.093494
26961341-5272-4df8-8bc0-e8599da94e7a,2,Buyer,"""Hidden bottlenecks""? That sounds a bit vague. We use a combination of our existing logging solutions and some custom scripts. Our engineers are quite capable. Frankly, we're not looking to rip and replace anything major right now, especially with NGINX One providing a unified management layer.",46,295,2026-02-19T16:09:03.093494
26961341-5272-4df8-8bc0-e8599da94e7a,3,Seller,"I appreciate that. And it's precisely because you have NGINX One and are leveraging cloud platforms that I thought our solution might be a good fit. DeepData AI is designed to integrate *with* your existing stack, not replace it. We specifically help accelerate the analysis of large, disparate datasets by using AI to automate much of that preparatory work – think automated anomaly detection in logs or predictive insights from user behavior data without weeks of manual scripting. We've seen companies reduce their data processing time by up to 60%.",90,552,2026-02-19T16:09:03.093494
26961341-5272-4df8-8bc0-e8599da94e7a,3,Buyer,"60% reduction? That's a bold claim. We've looked at AI-driven data solutions before, and the integration overhead and cost were prohibitive. Plus, our security team is very particular about what data gets processed and where. We already have F5 WAF and DoS for NGINX, and they're performing well.",48,296,2026-02-19T16:09:03.093494
26961341-5272-4df8-8bc0-e8599da94e7a,4,Seller,"I understand your skepticism, and we hear that often. Regarding integration, DeepData AI is designed with flexibility in mind, with connectors for common data sources and APIs that can fit into existing workflows, including those feeding into or out of your NGINX deployments. We don't require you to move all your data to a proprietary platform. And on security, our platform is built with zero-trust principles and can operate within your existing security posture. For a quick overview of how we've helped organizations similar to yours, I'd love to schedule a brief 15-minute call next week. We can demonstrate specific use cases relevant to your environment.",106,663,2026-02-19T16:09:03.093494
26961341-5272-4df8-8bc0-e8599da94e7a,4,Buyer,"Look, Alex, I appreciate the persistence, but the timing just isn't right. We're deep in a major cloud migration project right now, and introducing a new data processing tool, even with your claims of easy integration, is not a priority. We'll stick with our current tools for the foreseeable future. Thanks again for your time.",55,328,2026-02-19T16:09:03.093494
