simulation_id,turn_number,speaker,message,word_count,char_count,timestamp
95ad97c9-57ab-4b61-9b4a-dc6d03b938dd,1,Seller,"""Hi Mr. Thompson, my name is Alex from DeepData AI. I'm calling because we've been helping companies like yours, particularly CTOs, significantly reduce the time and resources spent on complex data processing and integration while dramatically improving data accuracy. Do you have a quick 30 seconds to hear how?""",49,313,2026-02-08T13:04:30.400820
95ad97c9-57ab-4b61-9b4a-dc6d03b938dd,1,Buyer,"""Alex, thanks for the call, but I'm actually in the middle of something critical right now. We're pretty set on our data stack and have a robust team managing it. What specifically is this about that warrants my immediate attention?""",40,233,2026-02-08T13:04:30.400820
95ad97c9-57ab-4b61-9b4a-dc6d03b938dd,2,Seller,"""Understood, Mr. Thompson, and I appreciate you even taking my call. My apologies for the timing. Many CTOs I speak with have invested heavily in custom ETL, but still struggle with scaling data ingestion, integrating disparate or messy data sources, or keeping up with data governance mandates. Are those areas your team has completely optimized, or do you still face some bottlenecks there?""",63,393,2026-02-08T13:04:30.400820
95ad97c9-57ab-4b61-9b4a-dc6d03b938dd,2,Buyer,"""Look, we've built our pipelines in-house, and yes, it's a constant effort, but we have control. 'DeepData AI' sounds like another black-box solution that promises magic. Our data security and compliance requirements are extremely stringent. How could an AI solution handle that better or more securely than our own engineers?""",50,327,2026-02-08T13:04:30.400820
95ad97c9-57ab-4b61-9b4a-dc6d03b938dd,3,Seller,"""That's a very valid concern, and 'black box' solutions are exactly what we aim to differentiate from. DeepData AI isn't about replacing your engineers; it's about augmenting them. Our platform uses explainable AI models to intelligently automate the *most tedious* parts of data prep, like schema inference across disparate sources or identifying PII for compliance, while keeping your team in full control and visibility. It integrates with your existing infrastructure, enhancing your data governance, not replacing it. Would you be open to a brief 15-minute screen share next week? I could quickly demo how our platform specifically tackles a compliance-focused data integration scenario, which might resonate with your team's challenges.""",110,743,2026-02-08T13:04:30.400820
43290c94-50b8-418e-b69a-fe7a0f601def,1,Seller,"Alex from DeepData AI. Hope I'm catching you at an okay time, Dr. Reed. My reason for reaching out is that we help tech companies like yours unlock deeper insights from their internal operational data, often without needing an army of data scientists.",43,251,2026-02-08T13:04:57.026424
43290c94-50b8-418e-b69a-fe7a0f601def,1,Buyer,"Alex, always great to hear from another AI vendor. Let me guess, you've got a brilliant AI that's going to transform everything, and all I need to do is upload all my sensitive corporate data to your cloud, right? We're currently dealing with a minefield of AI tools that are creating potential legal exposure just by existing.",57,327,2026-02-08T13:04:57.026424
43290c94-50b8-418e-b69a-fe7a0f601def,2,Seller,"I completely understand that sentiment, Dr. Reed, and honestly, it's a huge problem in the industry right now. You're right to be wary. DeepData AI is a bit different though; we're focused on processing your structured and unstructured operational data – things like system logs, customer support tickets, internal documents – not sales conversations. But the principle of data privacy is absolutely central to our design.",66,422,2026-02-08T13:04:57.026424
43290c94-50b8-418e-b69a-fe7a0f601def,2,Buyer,"Okay, so not sales conversations, but you still want my operational data. How is that any different? Are you telling me your architecture is 100% offline? Hardware-bound? Nothing leaves our machine or network, ever? Because anything less than that still creates a subpoena risk, and we're looking at solutions that fundamentally prevent that exposure by design, not just policy.",59,378,2026-02-08T13:04:57.026424
43290c94-50b8-418e-b69a-fe7a0f601def,3,Seller,"You're hitting on a critical point that many vendors sidestep. While DeepData AI isn't an 'offline only, hardware-bound' solution in the exact same way a zero-exposure AI sales coach might be – because our goal is processing *volumes* of diverse operational data – we've designed our architecture to give you maximum data sovereignty. We offer secure on-premise or private cloud deployments where *you* control the environment and data residency. No shared tenant data, advanced encryption with customer-managed keys, and strict access controls are fundamental.",84,561,2026-02-08T13:04:57.026424
43290c94-50b8-418e-b69a-fe7a0f601def,3,Buyer,"Hmm. So you're saying my data isn't just pooled with everyone else's on a vendor-controlled server, waiting for a legal request? You offer true data sovereignty, where it lives within our own secure perimeter? That's definitely a conversation worth having if it mitigates the kind of external subpoena risk we're actively trying to avoid with other AI solutions.",58,362,2026-02-08T13:04:57.026424
43290c94-50b8-418e-b69a-fe7a0f601def,4,Seller,"Exactly, Dr. Reed. Our goal is to empower you with insights *without* compromising your security posture or creating new legal liabilities. It's about data processing that works *for* you, within your rules. Would you be open to a brief 15-minute follow-up call next week to demonstrate how our architecture achieves this and discuss how it aligns with your internal data governance?",61,383,2026-02-08T13:04:57.026424
752c57c7-3f4b-4f17-860e-174c717bb689,1,Seller,"""Hi [CTO's Name], this is Alex from DeepData AI. I know you're incredibly busy, but I noticed [Company's Name] handles a massive volume of global transactions and subscriptions, likely leveraging Stripe's robust financial infrastructure. We specialize in helping CTOs like yourself turn that vast financial data into immediate, actionable intelligence without complex manual processing. I was hoping for just 30 seconds to explain how we've helped companies similar to yours enhance their data operations.""",74,506,2026-02-08T13:05:17.121356
752c57c7-3f4b-4f17-860e-174c717bb689,1,Buyer,"""Alex, thanks for the call. We're already quite sophisticated with our data processing. Our internal data engineering team, combined with our existing analytics platforms, handles all our financial data, including our Stripe feeds, very effectively. We've invested heavily there, and frankly, we're not actively looking to add another vendor or complexity to our stack.""",54,370,2026-02-08T13:05:17.121356
752c57c7-3f4b-4f17-860e-174c717bb689,2,Seller,"""I completely understand, [CTO's Name], and it sounds like you have a highly capable setup. Many of our clients have strong internal teams. Where DeepData AI typically complements that, especially for companies dealing with Stripe's scale and global complexity, is by automating the *pre-processing, enrichment, and real-time anomaly detection* within those massive datasets. This frees up engineering time from repetitive data prep to focus on higher-value initiatives. For instance, are your teams spending significant cycles just preparing multi-currency Stripe data for analysis, or building custom reconciliation logic that could be automated?""",91,649,2026-02-08T13:05:17.121356
752c57c7-3f4b-4f17-860e-174c717bb689,2,Buyer,"""Preparation is always a factor, yes, but we've streamlined those pipelines considerably. Our focus is on maintaining uptime and scaling our core product. Introducing another AI layer often means integration headaches, potential 'black box' issues, and more systems for my team to manage. We need full transparency and control, and my team's bandwidth is already stretched thin with mission-critical projects.""",60,410,2026-02-08T13:05:17.121356
752c57c7-3f4b-4f17-860e-174c717bb689,3,Seller,"""Those are absolutely critical concerns, [CTO's Name], and valid with many solutions out there. What sets DeepData AI apart is our modular, API-first approach, designed to integrate seamlessly without disrupting your existing infrastructure. We provide transparent, configurable models, not a black box, giving your team full control and visibility into the data lineage. Our goal isn't to replace your existing systems, but to *augment* them, specifically reducing the engineering effort needed to unlock deeper, real-time value from your massive Stripe datasets. Would you be open to a very brief, 15-minute call sometime next week where I could quickly show you how we integrate without disruption, and directly address your transparency and control requirements? No pressure beyond that.""",117,792,2026-02-08T13:05:17.121356
752c57c7-3f4b-4f17-860e-174c717bb689,3,Buyer,"""Hmm, 15 minutes is tight, but if you can genuinely demonstrate how DeepData AI integrates non-disruptively and specifically tackles the 'black box' concern for our kind of transaction volume... alright, send me an invite for sometime Tuesday morning. But be prepared to be exceptionally concise.""",45,297,2026-02-08T13:05:17.121356
968daf59-917c-4a45-a46f-6eee2b9edd86,1,Seller,"""Hi [CTO Name], my name is Alex from DeepData AI. I know you're incredibly busy, but I noticed IBM and AWS are heavily focused on accelerating data transformation and AI initiatives, which is exactly where we operate. We help companies, especially those scaling their AI on AWS, to streamline their data processing. I was curious if challenges around data velocity, governance, or optimizing costs for complex AI data pipelines are on your radar at all?""",75,454,2026-02-08T13:05:36.891932
968daf59-917c-4a45-a46f-6eee2b9edd86,1,Buyer,"""Alex, thanks for the call. We leverage a robust stack, including AWS native services and some of our IBM partnerships for data processing. We're pretty well-covered there, and frankly, my plate is full with our current transformation projects. We don't really have a 'bottleneck' in that area.""",47,295,2026-02-08T13:05:36.891932
968daf59-917c-4a45-a46f-6eee2b9edd86,2,Seller,"""I appreciate that, and it's great you have such a strong foundation with AWS and IBM. What we're finding, even with those excellent tools, is that as data volumes and sources explode – especially for advanced AI workloads like those IBM is pushing with agentic AI – keeping a unified view for governance, ensuring data quality at scale, and optimizing cloud resource spend can become incredibly complex. For instance, are you consistently hitting your SLAs for data delivery to your AI pipelines, or seeing unexpected cloud costs related to data movement and processing across your various systems?""",97,600,2026-02-08T13:05:36.891932
968daf59-917c-4a45-a46f-6eee2b9edd86,2,Buyer,"""We have sophisticated monitoring in place for our data pipelines, and cost optimization is an ongoing effort, of course. Our teams are competent in managing our AWS spend and ensuring data availability. I'm struggling to see where DeepData AI would fit in without adding another layer of complexity to an already integrated stack, especially when we're already working closely with IBM on data security and AI governance.""",67,423,2026-02-08T13:05:36.891932
968daf59-917c-4a45-a46f-6eee2b9edd86,3,Seller,"""That's a fair point, and we absolutely don't aim to rip and replace. Think of DeepData AI more as an intelligence layer *over* your existing AWS and IBM data services. Our AI-driven engine specifically identifies inefficiencies, automates data quality checks, and intelligently routes data for optimal processing, leading to a demonstrable 20-30% reduction in processing costs and significantly faster data-to-insight cycles without major refactoring. Many CTOs we speak with, even those well-integrated with AWS, are finding this level of optimization crucial as they push towards more ambitious AI projects. Would you be open to a brief 15-minute call next week, just to explore if any of those specific optimization areas resonate with your current initiatives?""",115,766,2026-02-08T13:05:36.891932
968daf59-917c-4a45-a46f-6eee2b9edd86,3,Buyer,"""Twenty to thirty percent is a bold claim, Alex. I'm open to understanding *how* you achieve that without adding operational overhead. Can you send me a brief overview, maybe a one-pager, and then we can look at a 15-minute slot next week? I'll need to see a clear value proposition before I commit more time.""",55,310,2026-02-08T13:05:36.891932
c7efa28d-4f2a-4a00-ac29-3d570b602488,1,Seller,"Hi, this is Alex from DeepData AI. I noticed your company is scaling fast—are you currently struggling with data processing costs?",21,130,2026-02-08T23:18:43.442043
c7efa28d-4f2a-4a00-ac29-3d570b602488,1,Buyer,"Alex, we're Salesforce, so naturally, we handle an immense scale of data, and we have significant internal investments and teams dedicated to optimizing those costs and processes. What specifically makes DeepData AI's approach superior to our own proprietary solutions and existing infrastructure?",42,297,2026-02-08T23:18:43.442043
c7efa28d-4f2a-4a00-ac29-3d570b602488,2,Seller,"That's precisely why I reached out; DeepData AI is designed to complement sophisticated internal systems like yours by pinpointing granular, AI-driven cost efficiencies and performance bottlenecks that even the most dedicated teams might miss. We consistently help companies achieve an *additional* layer of optimization, often uncovering overlooked opportunities that lead to significant further reductions in processing costs.",57,428,2026-02-08T23:18:43.442043
c7efa28d-4f2a-4a00-ac29-3d570b602488,2,Buyer,"""Alex, we've heard similar claims before. Without specific, *material* examples of how your 'AI-driven insights' provide a truly *novel* layer of optimization beyond what our substantial internal teams already achieve, the value proposition isn't clear enough to justify the potential integration complexity and cost of an external platform.""",48,342,2026-02-08T23:18:43.442043
c7efa28d-4f2a-4a00-ac29-3d570b602488,3,Seller,"I understand; the real value of our AI is in identifying *predictive* inefficiencies within complex, inter-service data flows that even the best internal teams often can't see with retrospective analysis. A brief meeting would allow me to share specific, anonymized examples of these novel insights and how they translate into significant savings.",52,347,2026-02-08T23:18:43.442043
c7efa28d-4f2a-4a00-ac29-3d570b602488,3,Buyer,"Alex, ""predictive inefficiencies"" is precisely the frontier our own advanced AI and data science teams are focused on internally. Unless you can articulate a truly novel technical approach or specific class of insights *before* a meeting, it's difficult to see where DeepData AI provides unique value beyond our existing capabilities.",50,334,2026-02-08T23:18:43.442043
c7efa28d-4f2a-4a00-ac29-3d570b602488,4,Seller,"Our platform leverages explainable AI on real-time causality graphs, specifically pinpointing *multi-layered, cross-domain cost correlations* that are inherently difficult for even advanced internal teams to observe from within their siloed data views. A brief meeting would allow me to illustrate, with anonymized examples, how these unique insights translate to tangible savings.",51,381,2026-02-08T23:18:43.442043
c7efa28d-4f2a-4a00-ac29-3d570b602488,4,Buyer,,0,0,2026-02-08T23:18:43.442043
7b97d187-c4d2-45f7-befa-b00dfed4e88a,1,Seller,"Hi, this is Alex from DeepData AI. I noticed your company is scaling fast—are you currently struggling with data processing costs?",21,130,2026-02-08T23:24:18.907347
7b97d187-c4d2-45f7-befa-b00dfed4e88a,1,Buyer,"Alex, we build our own comprehensive cloud software suite here at Zoho. We've developed robust internal systems to manage our data processing, so 'struggling' isn't a word I'd use to describe our current situation.",34,214,2026-02-08T23:24:18.907347
7b97d187-c4d2-45f7-befa-b00dfed4e88a,2,Seller,"That's incredibly impressive; it's clear you've made significant investments in your internal capabilities. The value we bring isn't about fixing struggles, but rather augmenting already robust systems to achieve unprecedented levels of efficiency and cost optimization for your most complex data workloads.",42,307,2026-02-08T23:24:18.907347
7b97d187-c4d2-45f7-befa-b00dfed4e88a,2,Buyer,"""Unprecedented levels of efficiency is a bold claim, Alex. Given our extensive internal optimizations, you'd need to demonstrate a truly significant and cost-effective improvement to justify integrating an external solution into our core infrastructure.""",34,254,2026-02-08T23:24:18.907347
7b97d187-c4d2-45f7-befa-b00dfed4e88a,3,Seller,"You're absolutely right, and that's precisely why we specialize in those **extremely complex, high-volume workloads** where traditional optimizations often plateau. We consistently uncover 20-30% further reduction in processing costs and time, even for organizations with advanced internal capabilities, which we could quickly demonstrate for your specific context in a brief call.",51,381,2026-02-08T23:24:18.907347
7b97d187-c4d2-45f7-befa-b00dfed4e88a,3,Buyer,"That 20-30% figure, while certainly eye-catching, would need to be thoroughly evaluated against the total cost of your solution and the substantial internal engineering resources required to integrate it into our finely-tuned infrastructure.",33,241,2026-02-08T23:24:18.907347
7b97d187-c4d2-45f7-befa-b00dfed4e88a,4,Seller,You're absolutely right to consider those factors; that's precisely why we prioritize a *net* ROI and have engineered our solution for a surprisingly low integration footprint. A quick call would allow me to walk you through how we achieve those 20-30% savings with minimal engineering lift on your end.,49,303,2026-02-08T23:24:18.907347
7b97d187-c4d2-45f7-befa-b00dfed4e88a,4,Buyer,"Minimal engineering lift and net ROI sound appealing, Alex, but you haven't given me any indication of the actual cost of your solution. For a company like Zoho, the upfront and recurring costs would need to be extremely competitive to justify an external integration over further internal optimization.",48,303,2026-02-08T23:24:18.907347
712bc609-3a46-422b-8aff-adb11a5bde7f,1,Seller,"Hi [CTO's Name], this is [SDR's Name] from DeepData AI. I'm calling because I saw your company is investing heavily in AI and customer success, which is great to see. At DeepData AI, we help companies like yours unlock deeper insights from their existing data, which can really supercharge those AI initiatives. Is this a good time for a quick chat?",61,349,2026-02-10T11:58:29.516989
712bc609-3a46-422b-8aff-adb11a5bde7f,1,Buyer,"DeepData AI, you say? Look, we're inundated with data vendors and AI solutions right now. Salesforce already provides us with a comprehensive CRM and claims to be the ""AI CRM"" leader. What makes you different, and why should I even consider another data processing solution?",45,274,2026-02-10T11:58:29.516989
712bc609-3a46-422b-8aff-adb11a5bde7f,2,Seller,"I completely understand the noise you're dealing with, [CTO's Name]. Salesforce is a powerful platform, no doubt. However, most CRMs, even advanced ones, often struggle to deeply analyze the *unstructured* or disparate data that exists *outside* the CRM – think customer support logs, internal notes, social media sentiment, and even your own internal system logs. Our platform specializes in unifying, cleaning, and enriching *all* of that data, making it truly actionable for your AI models, and ultimately, for your sales and service teams.",83,543,2026-02-10T11:58:29.516989
712bc609-3a46-422b-8aff-adb11a5bde7f,2,Buyer,"""Unstructured data."" That's a buzzword we hear constantly. We have data scientists who are supposed to be handling that. What tangible benefit does your ""deep data processing"" offer that our existing infrastructure and team can't achieve? We're already seeing significant ROI from Agentforce and our other AI investments.",48,321,2026-02-10T11:58:29.516989
712bc609-3a46-422b-8aff-adb11a5bde7f,3,Seller,"That's fantastic that you're already seeing ROI. Agentforce is impressive. What our clients typically find is that even with dedicated data scientists, extracting truly granular, actionable insights from vast amounts of unstructured data is incredibly time-consuming and resource-intensive. DeepData AI automates a significant portion of that heavy lifting. For example, we've helped companies identify previously invisible patterns in customer feedback that led to a 20% reduction in churn within six months, or pinpoint specific product issues before they impacted a large customer segment. It’s about giving your AI models – and your teams – a more complete and nuanced picture, not just what’s neatly organized in the CRM.",108,726,2026-02-10T11:58:29.516989
712bc609-3a46-422b-8aff-adb11a5bde7f,3,Buyer,"So, you're saying your solution can find something our data scientists can't, faster and cheaper? That's a bold claim. We've also had issues with data integration being a major headache. How does your platform handle that, especially with a complex ecosystem like ours?",43,269,2026-02-10T11:58:29.516989
95d8d39b-4033-42d1-8e30-05339eea47fd,1,Seller,"Hi [CTO Name], this is Alex from DeepData AI. I know you're likely swamped, so I'll be brief. We're helping companies like yours unify and make sense of their scattered data to drive better business decisions. I came across Innovate Solutions and was impressed with your growth in [mention a recent positive company achievement if possible, e.g., ""your recent product launch""].",61,377,2026-02-10T11:58:47.393064
95d8d39b-4033-42d1-8e30-05339eea47fd,1,Buyer,"(Skeptical tone) Alex, thanks for calling. We're always looking at ways to improve, but honestly, we get a lot of these calls. What makes DeepData AI any different from the dozen other data platforms out there? We're pretty well-invested in our current stack, including HubSpot.",45,278,2026-02-10T11:58:47.393064
95d8d39b-4033-42d1-8e30-05339eea47fd,2,Seller,"That's a fair question, [CTO Name]. We hear that often. What sets us apart is our focus on truly *unified intelligence* from *all* your sources, not just within a single platform. While HubSpot is excellent for its core functions, we understand many companies like yours end up with data silos in other systems – marketing automation, ERP, maybe even legacy databases. DeepData AI acts as that intelligent layer that connects these, cleans them, and then surfaces insights you can act on, whether it's identifying customer churn risks or optimizing your marketing spend across channels.",94,586,2026-02-10T11:58:47.393064
95d8d39b-4033-42d1-8e30-05339eea47fd,2,Buyer,"So, you're saying you integrate with everything? We've tried integrating with other tools before, and it's always been a nightmare. Lots of custom work, ongoing maintenance, and frankly, a drain on our engineering resources. I'm not looking to add more complexity to our existing infrastructure.",45,295,2026-02-10T11:58:47.393064
95d8d39b-4033-42d1-8e30-05339eea47fd,3,Seller,"I completely understand your concern about complexity and resource drain. That's precisely why we've built DeepData AI for rapid integration and minimal overhead. We leverage pre-built connectors and a streamlined API that typically gets us up and running with a significant portion of your existing stack, including HubSpot and common enterprise applications, within weeks, not months. Our focus is on *delivering insights*, not on becoming another engineering project for your team. We handle the heavy lifting of data unification and analysis.",81,546,2026-02-10T11:58:47.393064
95d8d39b-4033-42d1-8e30-05339eea47fd,3,Buyer,"Weeks? That sounds optimistic. And what kind of ""insights"" are we talking about? We've got BI tools that give us dashboards. We need to see a clear ROI and tangible improvements, not just more data. How does DeepData AI translate into actual business value that justifies adding another vendor?",49,294,2026-02-10T11:58:47.393064
95d8d39b-4033-42d1-8e30-05339eea47fd,4,Seller,"Great point about ROI. We've seen clients achieve [mention a specific, quantifiable benefit, e.g., ""a 15% improvement in customer retention"" or ""a 10% reduction in customer acquisition cost""] by identifying cross-sell opportunities or predicting at-risk accounts that were previously invisible. DeepData AI's AI-powered analytics go beyond standard dashboards by uncovering hidden patterns and predictive trends. I can share a brief case study on how a company in a similar industry to yours saw [mention another quantifiable benefit] within 90 days. Would you be open to a quick 15-minute overview next week to see if there's a potential fit?",98,643,2026-02-10T11:58:47.393064
500e3046-237e-463a-93fb-5a0501fa2709,1,Seller,"Hi [CTO Name], this is [SDR Name] from DeepData AI. I'm reaching out because we're seeing a lot of companies, especially those heavily reliant on tools like Slack for their day-to-day operations, struggling to extract meaningful, actionable insights from the sheer volume of conversational and document data they generate. Does that resonate at all with your current data strategy at [Company Name]?",62,399,2026-02-10T11:59:03.427133
500e3046-237e-463a-93fb-5a0501fa2709,1,Buyer,"[SDR Name], thanks for the call. Look, we're pretty swamped here. And honestly, Slack's AI features are supposed to be handling a lot of that ""insight"" generation for us. We're already paying for Slack's advanced tiers, and they're pushing AI pretty hard. What makes DeepData AI so different that we should even consider it?",54,324,2026-02-10T11:59:03.427133
