simulation_id,turn_number,speaker,message,word_count,char_count,timestamp
43290c94-50b8-418e-b69a-fe7a0f601def,1,Seller,"Alex from DeepData AI. Hope I'm catching you at an okay time, Dr. Reed. My reason for reaching out is that we help tech companies like yours unlock deeper insights from their internal operational data, often without needing an army of data scientists.",43,251,2026-02-08T13:04:57.026424
43290c94-50b8-418e-b69a-fe7a0f601def,1,Buyer,"Alex, always great to hear from another AI vendor. Let me guess, you've got a brilliant AI that's going to transform everything, and all I need to do is upload all my sensitive corporate data to your cloud, right? We're currently dealing with a minefield of AI tools that are creating potential legal exposure just by existing.",57,327,2026-02-08T13:04:57.026424
43290c94-50b8-418e-b69a-fe7a0f601def,2,Seller,"I completely understand that sentiment, Dr. Reed, and honestly, it's a huge problem in the industry right now. You're right to be wary. DeepData AI is a bit different though; we're focused on processing your structured and unstructured operational data – things like system logs, customer support tickets, internal documents – not sales conversations. But the principle of data privacy is absolutely central to our design.",66,422,2026-02-08T13:04:57.026424
43290c94-50b8-418e-b69a-fe7a0f601def,2,Buyer,"Okay, so not sales conversations, but you still want my operational data. How is that any different? Are you telling me your architecture is 100% offline? Hardware-bound? Nothing leaves our machine or network, ever? Because anything less than that still creates a subpoena risk, and we're looking at solutions that fundamentally prevent that exposure by design, not just policy.",59,378,2026-02-08T13:04:57.026424
43290c94-50b8-418e-b69a-fe7a0f601def,3,Seller,"You're hitting on a critical point that many vendors sidestep. While DeepData AI isn't an 'offline only, hardware-bound' solution in the exact same way a zero-exposure AI sales coach might be – because our goal is processing *volumes* of diverse operational data – we've designed our architecture to give you maximum data sovereignty. We offer secure on-premise or private cloud deployments where *you* control the environment and data residency. No shared tenant data, advanced encryption with customer-managed keys, and strict access controls are fundamental.",84,561,2026-02-08T13:04:57.026424
43290c94-50b8-418e-b69a-fe7a0f601def,3,Buyer,"Hmm. So you're saying my data isn't just pooled with everyone else's on a vendor-controlled server, waiting for a legal request? You offer true data sovereignty, where it lives within our own secure perimeter? That's definitely a conversation worth having if it mitigates the kind of external subpoena risk we're actively trying to avoid with other AI solutions.",58,362,2026-02-08T13:04:57.026424
43290c94-50b8-418e-b69a-fe7a0f601def,4,Seller,"Exactly, Dr. Reed. Our goal is to empower you with insights *without* compromising your security posture or creating new legal liabilities. It's about data processing that works *for* you, within your rules. Would you be open to a brief 15-minute follow-up call next week to demonstrate how our architecture achieves this and discuss how it aligns with your internal data governance?",61,383,2026-02-08T13:04:57.026424
752c57c7-3f4b-4f17-860e-174c717bb689,1,Seller,"""Hi [CTO's Name], this is Alex from DeepData AI. I know you're incredibly busy, but I noticed [Company's Name] handles a massive volume of global transactions and subscriptions, likely leveraging Stripe's robust financial infrastructure. We specialize in helping CTOs like yourself turn that vast financial data into immediate, actionable intelligence without complex manual processing. I was hoping for just 30 seconds to explain how we've helped companies similar to yours enhance their data operations.""",74,506,2026-02-08T13:05:17.121356
752c57c7-3f4b-4f17-860e-174c717bb689,1,Buyer,"""Alex, thanks for the call. We're already quite sophisticated with our data processing. Our internal data engineering team, combined with our existing analytics platforms, handles all our financial data, including our Stripe feeds, very effectively. We've invested heavily there, and frankly, we're not actively looking to add another vendor or complexity to our stack.""",54,370,2026-02-08T13:05:17.121356
752c57c7-3f4b-4f17-860e-174c717bb689,2,Seller,"""I completely understand, [CTO's Name], and it sounds like you have a highly capable setup. Many of our clients have strong internal teams. Where DeepData AI typically complements that, especially for companies dealing with Stripe's scale and global complexity, is by automating the *pre-processing, enrichment, and real-time anomaly detection* within those massive datasets. This frees up engineering time from repetitive data prep to focus on higher-value initiatives. For instance, are your teams spending significant cycles just preparing multi-currency Stripe data for analysis, or building custom reconciliation logic that could be automated?""",91,649,2026-02-08T13:05:17.121356
752c57c7-3f4b-4f17-860e-174c717bb689,2,Buyer,"""Preparation is always a factor, yes, but we've streamlined those pipelines considerably. Our focus is on maintaining uptime and scaling our core product. Introducing another AI layer often means integration headaches, potential 'black box' issues, and more systems for my team to manage. We need full transparency and control, and my team's bandwidth is already stretched thin with mission-critical projects.""",60,410,2026-02-08T13:05:17.121356
752c57c7-3f4b-4f17-860e-174c717bb689,3,Seller,"""Those are absolutely critical concerns, [CTO's Name], and valid with many solutions out there. What sets DeepData AI apart is our modular, API-first approach, designed to integrate seamlessly without disrupting your existing infrastructure. We provide transparent, configurable models, not a black box, giving your team full control and visibility into the data lineage. Our goal isn't to replace your existing systems, but to *augment* them, specifically reducing the engineering effort needed to unlock deeper, real-time value from your massive Stripe datasets. Would you be open to a very brief, 15-minute call sometime next week where I could quickly show you how we integrate without disruption, and directly address your transparency and control requirements? No pressure beyond that.""",117,792,2026-02-08T13:05:17.121356
752c57c7-3f4b-4f17-860e-174c717bb689,3,Buyer,"""Hmm, 15 minutes is tight, but if you can genuinely demonstrate how DeepData AI integrates non-disruptively and specifically tackles the 'black box' concern for our kind of transaction volume... alright, send me an invite for sometime Tuesday morning. But be prepared to be exceptionally concise.""",45,297,2026-02-08T13:05:17.121356
c7efa28d-4f2a-4a00-ac29-3d570b602488,1,Seller,"Hi, this is Alex from DeepData AI. I noticed your company is scaling fast—are you currently struggling with data processing costs?",21,130,2026-02-08T23:18:43.442043
c7efa28d-4f2a-4a00-ac29-3d570b602488,1,Buyer,"Alex, we're Salesforce, so naturally, we handle an immense scale of data, and we have significant internal investments and teams dedicated to optimizing those costs and processes. What specifically makes DeepData AI's approach superior to our own proprietary solutions and existing infrastructure?",42,297,2026-02-08T23:18:43.442043
c7efa28d-4f2a-4a00-ac29-3d570b602488,2,Seller,"That's precisely why I reached out; DeepData AI is designed to complement sophisticated internal systems like yours by pinpointing granular, AI-driven cost efficiencies and performance bottlenecks that even the most dedicated teams might miss. We consistently help companies achieve an *additional* layer of optimization, often uncovering overlooked opportunities that lead to significant further reductions in processing costs.",57,428,2026-02-08T23:18:43.442043
c7efa28d-4f2a-4a00-ac29-3d570b602488,2,Buyer,"""Alex, we've heard similar claims before. Without specific, *material* examples of how your 'AI-driven insights' provide a truly *novel* layer of optimization beyond what our substantial internal teams already achieve, the value proposition isn't clear enough to justify the potential integration complexity and cost of an external platform.""",48,342,2026-02-08T23:18:43.442043
c7efa28d-4f2a-4a00-ac29-3d570b602488,3,Seller,"I understand; the real value of our AI is in identifying *predictive* inefficiencies within complex, inter-service data flows that even the best internal teams often can't see with retrospective analysis. A brief meeting would allow me to share specific, anonymized examples of these novel insights and how they translate into significant savings.",52,347,2026-02-08T23:18:43.442043
c7efa28d-4f2a-4a00-ac29-3d570b602488,3,Buyer,"Alex, ""predictive inefficiencies"" is precisely the frontier our own advanced AI and data science teams are focused on internally. Unless you can articulate a truly novel technical approach or specific class of insights *before* a meeting, it's difficult to see where DeepData AI provides unique value beyond our existing capabilities.",50,334,2026-02-08T23:18:43.442043
c7efa28d-4f2a-4a00-ac29-3d570b602488,4,Seller,"Our platform leverages explainable AI on real-time causality graphs, specifically pinpointing *multi-layered, cross-domain cost correlations* that are inherently difficult for even advanced internal teams to observe from within their siloed data views. A brief meeting would allow me to illustrate, with anonymized examples, how these unique insights translate to tangible savings.",51,381,2026-02-08T23:18:43.442043
c7efa28d-4f2a-4a00-ac29-3d570b602488,4,Buyer,,0,0,2026-02-08T23:18:43.442043
7b97d187-c4d2-45f7-befa-b00dfed4e88a,1,Seller,"Hi, this is Alex from DeepData AI. I noticed your company is scaling fast—are you currently struggling with data processing costs?",21,130,2026-02-08T23:24:18.907347
7b97d187-c4d2-45f7-befa-b00dfed4e88a,1,Buyer,"Alex, we build our own comprehensive cloud software suite here at Zoho. We've developed robust internal systems to manage our data processing, so 'struggling' isn't a word I'd use to describe our current situation.",34,214,2026-02-08T23:24:18.907347
7b97d187-c4d2-45f7-befa-b00dfed4e88a,2,Seller,"That's incredibly impressive; it's clear you've made significant investments in your internal capabilities. The value we bring isn't about fixing struggles, but rather augmenting already robust systems to achieve unprecedented levels of efficiency and cost optimization for your most complex data workloads.",42,307,2026-02-08T23:24:18.907347
7b97d187-c4d2-45f7-befa-b00dfed4e88a,2,Buyer,"""Unprecedented levels of efficiency is a bold claim, Alex. Given our extensive internal optimizations, you'd need to demonstrate a truly significant and cost-effective improvement to justify integrating an external solution into our core infrastructure.""",34,254,2026-02-08T23:24:18.907347
7b97d187-c4d2-45f7-befa-b00dfed4e88a,3,Seller,"You're absolutely right, and that's precisely why we specialize in those **extremely complex, high-volume workloads** where traditional optimizations often plateau. We consistently uncover 20-30% further reduction in processing costs and time, even for organizations with advanced internal capabilities, which we could quickly demonstrate for your specific context in a brief call.",51,381,2026-02-08T23:24:18.907347
7b97d187-c4d2-45f7-befa-b00dfed4e88a,3,Buyer,"That 20-30% figure, while certainly eye-catching, would need to be thoroughly evaluated against the total cost of your solution and the substantial internal engineering resources required to integrate it into our finely-tuned infrastructure.",33,241,2026-02-08T23:24:18.907347
7b97d187-c4d2-45f7-befa-b00dfed4e88a,4,Seller,You're absolutely right to consider those factors; that's precisely why we prioritize a *net* ROI and have engineered our solution for a surprisingly low integration footprint. A quick call would allow me to walk you through how we achieve those 20-30% savings with minimal engineering lift on your end.,49,303,2026-02-08T23:24:18.907347
7b97d187-c4d2-45f7-befa-b00dfed4e88a,4,Buyer,"Minimal engineering lift and net ROI sound appealing, Alex, but you haven't given me any indication of the actual cost of your solution. For a company like Zoho, the upfront and recurring costs would need to be extremely competitive to justify an external integration over further internal optimization.",48,303,2026-02-08T23:24:18.907347
f8c7a6c3-65d5-42af-aebc-86c02028eb53,1,Seller,"Hi, this is Alex from DeepData AI. I noticed your company is scaling fast—are you currently struggling with data processing costs?",21,130,2026-02-11T13:48:02.016120
f8c7a6c3-65d5-42af-aebc-86c02028eb53,1,Buyer,"""Scaling fast means we're *investing* in our infrastructure, Alex. What makes you so sure our data processing costs are a 'struggle' and not a strategic expense?""",26,162,2026-02-11T13:48:02.016120
f8c7a6c3-65d5-42af-aebc-86c02028eb53,2,Seller,"That's a great point, and it's fantastic that you're strategically investing. My question stems from seeing many high-growth companies like yours discover that as data volume explodes, those ""strategic expenses"" can quickly become a significant drag on profitability and speed, which is exactly where DeepData AI helps optimize.",48,328,2026-02-11T13:48:02.016120
f8c7a6c3-65d5-42af-aebc-86c02028eb53,2,Buyer,"""Optimize how, exactly? We have a robust cloud infrastructure. What's your magic bullet that makes our current setup inefficient or overly expensive at scale?""",24,159,2026-02-11T13:48:02.016120
f8c7a6c3-65d5-42af-aebc-86c02028eb53,3,Seller,"That's a fair question! DeepData AI doesn't replace your robust cloud infrastructure, but rather *enhances* it by intelligently optimizing data processing and storage, leading to significant cost reductions and faster insights without compromising performance. Could I show you in a quick 15-minute call how we've helped similar companies trim their data expenses by up to 30%?",56,377,2026-02-11T13:48:02.016120
f8c7a6c3-65d5-42af-aebc-86c02028eb53,3,Buyer,"""Up to 30%"" is a broad claim, Alex. Given our existing cloud investments, I'd need to see a far more concrete ROI projection for a 15-minute call to be worthwhile.",30,163,2026-02-11T13:48:02.016120
f8c7a6c3-65d5-42af-aebc-86c02028eb53,4,Seller,"I understand your need for concrete ROI, and that ""up to 30%"" is a strong statement. During a brief 15-minute call, I can quickly walk you through a case study tailored to your industry that outlines a more specific ROI projection and the factors contributing to those savings, giving you a clearer picture of potential value.",56,326,2026-02-11T13:48:02.016120
f8c7a6c3-65d5-42af-aebc-86c02028eb53,4,Buyer,"A case study is interesting, but I'm more concerned about integration complexity and vendor lock-in. How does DeepData AI seamlessly integrate with our existing cloud stack, and what assurances do you offer against being tied to your platform long-term?",39,253,2026-02-11T13:48:02.016120
ff7f940f-c730-48fa-a195-10c060b068a0,1,Seller,"Hi, this is Alex from DeepData AI. I noticed your company is scaling fast—are you currently struggling with data processing costs?",21,130,2026-02-11T13:51:23.910688
ff7f940f-c730-48fa-a195-10c060b068a0,1,Buyer,"Scaling fast means our priorities are elsewhere right now. Unless you have a dramatically different approach to data processing that’s orders of magnitude cheaper than what we've already implemented, I'm not sure this is a conversation worth diverting resources for.",40,266,2026-02-11T13:51:23.910688
ff7f940f-c730-48fa-a195-10c060b068a0,2,Seller,"I completely understand that priorities are high when scaling, and it's smart to focus on what matters most. Our clients have found that by addressing data processing inefficiencies, they actually *free up* resources and capital that can be redirected to those core scaling initiatives – often with significant cost savings. Would you be open to a brief chat to see if that's a possibility for you?",66,398,2026-02-11T13:51:23.910688
ff7f940f-c730-48fa-a195-10c060b068a0,2,Buyer,"""Orders of magnitude cheaper"" is a bold claim. Frankly, Alex, I've heard that line before from a dozen other vendors promising the moon. What makes DeepData AI so *orders of magnitude* different that you can actually deliver on that, and what's the proof?",43,255,2026-02-11T13:51:23.910688
ff7f940f-c730-48fa-a195-10c060b068a0,3,Seller,"That's a fair point, and we understand the skepticism given past experiences. The ""orders of magnitude"" difference comes from our unique AI-driven approach that automates complex data transformation pipelines, something that typically requires significant manual engineering and thus drives up costs. I'd be happy to share a quick case study showing how we've achieved this for companies similar to yours, if you're open to a 15-minute call next week.",69,451,2026-02-11T13:51:23.910688
ff7f940f-c730-48fa-a195-10c060b068a0,3,Buyer,"Another AI-driven automation that requires a ""quick case study"" to explain? Show me the raw numbers, not another story, before I even consider a 15-minute call.",26,160,2026-02-11T13:51:23.910688
ff7f940f-c730-48fa-a195-10c060b068a0,4,Seller,"You're right to push for tangible results, and we're happy to share them. We can show you a clear ROI projection based on your data volume and current processing stack in a brief call, demonstrating the cost savings before diving into specific case studies.",44,257,2026-02-11T13:51:23.910688
ff7f940f-c730-48fa-a195-10c060b068a0,4,Buyer,"Alright, an ROI projection is a start, but I'm still not seeing how you're ""orders of magnitude"" cheaper. Many vendors can provide projections; the real question is your ability to *outperform* existing solutions, not just present a shiny forecast.",39,248,2026-02-11T13:51:23.910688
e04242f3-b038-4f9f-b949-11e4f8334281,1,Seller,"Hi, this is Alex from DeepData AI. I noticed your company is scaling fast—are you currently struggling with data processing costs?",21,130,2026-02-11T14:16:10.465177
e04242f3-b038-4f9f-b949-11e4f8334281,1,Buyer,"""We're indeed scaling quickly, but I'm not convinced that your solution is the most cost-effective option, especially considering the hefty price tags I've seen from similar AI-powered data processing vendors like Google Cloud and AWS - how does your pricing model stack up against the competition?""",46,299,2026-02-11T14:16:10.465177
e04242f3-b038-4f9f-b949-11e4f8334281,2,Seller,"""I completely understand your concern about cost-effectiveness, but our pricing model is actually tailored to provide significant savings for high-volume data processing, with some of our clients seeing up to 30% reduction in costs compared to Google Cloud and AWS. I'd love to schedule a meeting to walk you through a customized cost-benefit analysis and demonstrate how DeepData AI can help you scale efficiently while optimizing your budget.""",68,445,2026-02-11T14:16:10.465177
e04242f3-b038-4f9f-b949-11e4f8334281,2,Buyer,"I'm still not convinced that your solution can deliver the promised 30% cost reduction, especially considering the significant investments we've already made in our existing infrastructure, and I'd need to see concrete case studies and benchmarks comparing your pricing to that of Google Cloud and AWS before considering a meeting. Furthermore, I'm concerned that integrating your solution would require substantial upfront costs and downtime, which could outweigh any potential long-term savings.",71,497,2026-02-11T14:16:10.465177
e04242f3-b038-4f9f-b949-11e4f8334281,3,Seller,"I understand your skepticism, and I'd be happy to provide you with case studies from similar companies that have achieved significant cost savings with DeepData AI, such as our recent engagement with XYZ Corporation, which saw a 32% reduction in data processing costs. Would you be open to a brief, 15-minute meeting to review these case studies and discuss how our solution can be integrated with your existing infrastructure to minimize downtime and upfront costs?",75,466,2026-02-11T14:16:10.465177
e04242f3-b038-4f9f-b949-11e4f8334281,3,Buyer,"I'm still not convinced that a 15-minute meeting will be sufficient to alleviate my concerns, especially considering the complexity of our existing infrastructure and the potential risks associated with integrating a new solution. Furthermore, I'd like to know how your pricing model compares to that of Microsoft Azure, which we're also currently evaluating, before I consider dedicating any time to reviewing case studies or discussing integration details.",67,458,2026-02-11T14:16:10.465177
e04242f3-b038-4f9f-b949-11e4f8334281,4,Seller,"I completely understand the complexity of your infrastructure and the need for a thorough evaluation, which is why I'd like to offer a 30-minute meeting instead, where we can dive deeper into your specific use case and provide a detailed comparison of our pricing model to Microsoft Azure, as well as showcase our seamless integration capabilities. This meeting will allow us to address your concerns and demonstrate how DeepData AI can help you optimize your data processing costs and improve efficiency, while also providing a clear ROI analysis tailored to your business needs.",93,580,2026-02-11T14:16:10.465177
e04242f3-b038-4f9f-b949-11e4f8334281,4,Buyer,"I'm still hesitant to commit to a 30-minute meeting without seeing concrete evidence of DeepData AI's cost savings and integration capabilities, especially since we're already in advanced discussions with Microsoft Azure and their pricing model seems more transparent and competitive. Can you provide a written comparison of your pricing model to Microsoft Azure's, including any additional fees or costs associated with integration and maintenance, before I consider dedicating time to a meeting?",72,497,2026-02-11T14:16:10.465177
6683d487-39df-46d4-83d5-41b1732bedc2,1,Seller,"Hi, this is Alex from DeepData AI. I noticed your company is scaling fast—are you currently struggling with data processing costs?",21,130,2026-02-11T14:21:47.051264
6683d487-39df-46d4-83d5-41b1732bedc2,1,Buyer,"""We've actually been investing heavily in our data infrastructure, so I'm not convinced that our current data processing costs are a major pain point worth addressing right now, especially considering the significant upfront costs that typically come with implementing a new AI-powered solution like yours. Can you tell me what sets DeepData AI apart from competitors like Alteryx, and what kind of ROI I can expect from your product?""",69,435,2026-02-11T14:21:47.051264
6683d487-39df-46d4-83d5-41b1732bedc2,2,Seller,"I completely understand your investment in data infrastructure, but what sets DeepData AI apart is our ability to optimize data processing costs by up to 40% while also providing real-time insights, which can lead to a significant ROI of 3-5 times the initial investment. I'd love to schedule a meeting to discuss how our solution can complement your existing infrastructure and provide a customized ROI analysis tailored to your company's specific needs.",72,455,2026-02-11T14:21:47.051264
6683d487-39df-46d4-83d5-41b1732bedc2,2,Buyer,"I'm not convinced that a 40% reduction in data processing costs is enough to justify the investment in your solution, especially considering the significant upfront costs and the fact that we've already invested heavily in our existing data infrastructure with Alteryx. Can you provide concrete case studies or benchmarks that demonstrate the actual ROI and implementation timelines for similar companies to ours, rather than just theoretical projections?",67,455,2026-02-11T14:21:47.051264
6683d487-39df-46d4-83d5-41b1732bedc2,3,Seller,"I'd be happy to share a case study from a similar company in your industry, such as NovaTech, who achieved a 42% reduction in data processing costs and a 4.2x ROI within 6 months of implementing DeepData AI, and I'd love to discuss how we can help you achieve similar results in a meeting. Would you be available for a 30-minute call next week to review the case study and explore how our solution can complement your existing Alteryx infrastructure?",80,450,2026-02-11T14:21:47.051264
6683d487-39df-46d4-83d5-41b1732bedc2,3,Buyer,"I'm still not convinced that the potential cost savings outweigh the upfront investment, and I'm concerned that integrating DeepData AI with our existing Alteryx infrastructure will require significant resources and time, potentially disrupting our current operations. Before considering a meeting, I'd like to see a more detailed analysis of the total cost of ownership and a comparison of the implementation timelines and costs versus our current Alteryx setup.",68,463,2026-02-11T14:21:47.051264
6683d487-39df-46d4-83d5-41b1732bedc2,4,Seller,"I'd be happy to provide a personalized Total Cost of Ownership analysis and a comparison of implementation timelines and costs versus your current Alteryx setup, which I can review with you in a meeting, and I believe this will help alleviate your concerns and demonstrate the long-term value that DeepData AI can bring to your organization. Would you be available for a 30-minute call next week to discuss the analysis and explore how our solution can complement your existing infrastructure while minimizing disruption to your operations?",86,540,2026-02-11T14:21:47.051264
