simulation_id,turn_number,speaker,message,word_count,char_count,timestamp
4f65306d-faeb-4d6c-bc3e-281eb6bb699d,2,Seller,"I completely understand your skepticism, but DeepData AI is designed to complement your existing observability stack. Our solution uses AI-powered processing to identify patterns and anomalies in your data that might be missed by traditional monitoring tools. This can help you reduce downtime, optimize performance, and even predict potential issues before they occur. For example, we've seen companies like yours reduce their mean time to detect (MTTD) by up to 50% with our solution.",74,486,2026-02-17T17:47:17.183912
4f65306d-faeb-4d6c-bc3e-281eb6bb699d,2,Buyer,"(still skeptical) That sounds like a lot of marketing fluff. How does it actually work, and what kind of integration would we need to do with our existing tools? We can't afford to rip and replace our entire monitoring infrastructure.",40,234,2026-02-17T17:47:17.183912
4f65306d-faeb-4d6c-bc3e-281eb6bb699d,3,Seller,"I'd be happy to walk you through the technical details. DeepData AI integrates with your existing data sources, including Grafana and Prometheus, through APIs and plugins. Our solution can ingest data from multiple sources, process it in real-time, and provide actionable insights through a user-friendly interface. We've had success with similar companies in the past, and our professional services team can work with you to ensure a seamless integration. We also offer a free trial, so you can see the value for yourself before committing to anything.",87,553,2026-02-17T17:47:17.183912
4f65306d-faeb-4d6c-bc3e-281eb6bb699d,3,Buyer,"(somewhat interested) Okay, I'll bite. What kind of ROI can we expect from implementing DeepData AI? We're always looking for ways to optimize our operations and reduce costs, but we need to see a clear business case for any new investment.",41,240,2026-02-17T17:47:17.183912
4f65306d-faeb-4d6c-bc3e-281eb6bb699d,4,Seller,"Our customers have seen significant ROI from using DeepData AI, ranging from 200% to 500% return on investment. By reducing downtime, optimizing resource utilization, and improving incident response, companies can save millions of dollars in operational costs. I'd be happy to provide some case studies and references from similar companies in your industry, and we can also work together to build a customized business case for your organization.",68,447,2026-02-17T17:47:17.183912
4f65306d-faeb-4d6c-bc3e-281eb6bb699d,4,Buyer,"(thoughtful) Alright, I'm willing to listen more. Can you send me some information about your solution, including those case studies and some technical details about the integration with Grafana and Prometheus? I'll review it and discuss it with our team, and we can schedule a follow-up call to explore further.",50,312,2026-02-17T17:47:17.183912
481edb47-1516-4535-a9de-0a55101716eb,1,Seller,"Hi, my name is Alex and I'm reaching out from DeepData AI. We're a data processing solution that helps companies like yours optimize their data management and analytics. I came across Elastic and was impressed with the work you're doing in search, observability, and security. Can you tell me a little bit about your current data processing challenges?",58,352,2026-02-17T17:47:23.553643
481edb47-1516-4535-a9de-0a55101716eb,1,Buyer,"(sighs) Look, we're already using Elasticsearch and it's working fine for us. What makes you think we need another data processing solution? We've got a lot of investments in our current stack and I'm not sure I want to add another vendor to the mix.",45,250,2026-02-17T17:47:23.553643
481edb47-1516-4535-a9de-0a55101716eb,2,Seller,"I completely understand your concerns about adding another vendor, but DeepData AI is designed to complement existing solutions like Elasticsearch. Our platform uses AI-powered processing to uncover hidden insights and patterns in your data, which can help you make more informed decisions. We've seen companies like yours achieve significant reductions in data processing time and costs by using our solution in conjunction with their existing tools. Would you be open to exploring how DeepData AI can enhance your existing Elasticsearch deployment?",81,550,2026-02-17T17:47:23.553643
481edb47-1516-4535-a9de-0a55101716eb,2,Buyer,"(skeptical) I'm not sure I buy into the whole ""AI-powered"" thing. We've got a team of experienced data engineers who are capable of handling our data processing needs. What makes you think your solution is better than what we've got in-house? And how does it integrate with our existing Elasticsearch setup?",51,307,2026-02-17T17:47:23.553643
481edb47-1516-4535-a9de-0a55101716eb,3,Seller,"I'd be happy to provide more information on our integration with Elasticsearch. We've developed a native connector that allows for seamless integration with your existing Elasticsearch cluster. Our solution can ingest data from Elasticsearch, process it using our AI-powered algorithms, and then write the results back to your Elasticsearch index. This allows you to leverage the power of DeepData AI while still utilizing your existing Elasticsearch investment. As for our AI-powered processing, it's not meant to replace your team, but rather augment their capabilities. Our platform can handle large volumes of data and perform complex processing tasks much faster and more accurately than human engineers. We've seen companies achieve significant reductions in data processing time and costs by using our solution. Would you be willing to explore a proof-of-concept to see how DeepData AI can specifically address your data processing challenges and integrate with your Elasticsearch setup?",147,994,2026-02-17T17:47:23.553643
481edb47-1516-4535-a9de-0a55101716eb,3,Buyer,"(still skeptical) Okay, fine. I'll consider it. But I need to see some concrete evidence that your solution can deliver the results you're promising. And I need to know that it's going to be easy to integrate with our existing systems. Can you provide some case studies or references from similar companies that have successfully implemented DeepData AI with Elasticsearch? And what kind of support and resources do you offer to ensure a smooth integration process?",76,465,2026-02-17T17:47:23.553643
481edb47-1516-4535-a9de-0a55101716eb,4,Seller,"Absolutely. We've worked with several companies in the tech space who have seen significant benefits from using DeepData AI in conjunction with Elasticsearch. I can provide you with some case studies and references that demonstrate the value we can bring. We also offer a comprehensive onboarding program, which includes dedicated support and resources to ensure a smooth integration process. We'll work closely with your team to ensure that our solution is properly integrated with your existing systems and that you're getting the most out of our platform. Would you like me to send over some more information and schedule a follow-up call to discuss further?",105,661,2026-02-17T17:47:23.553643
2c1bb307-7fbe-4974-bccf-34833e61b4ab,1,Seller,"Hi, my name is Alex and I'm reaching out from DeepData AI. We're a data processing solution that helps companies like yours optimize their data infrastructure and improve decision-making. I came across your company, Dynatrace, and was impressed with the work you're doing in observability and AI. Can you tell me a little bit about your current data processing challenges?",60,372,2026-02-17T17:47:29.528758
2c1bb307-7fbe-4974-bccf-34833e61b4ab,1,Buyer,"(skeptical) Ah, another data processing solution. What makes DeepData AI so special? We're already invested in our own observability platform, and I'm not sure we need another tool in our stack. What problem are you trying to solve that we're not already addressing?",43,266,2026-02-17T17:47:29.528758
2c1bb307-7fbe-4974-bccf-34833e61b4ab,2,Seller,"I understand your skepticism, but DeepData AI is designed to complement existing observability platforms like Dynatrace. Our solution focuses on advanced data processing and analytics, allowing companies to extract more value from their data. We've seen significant ROI for our customers in terms of improved data quality, reduced latency, and enhanced decision-making. I'd love to discuss some specific use cases and see if there's a potential fit for your organization.",70,471,2026-02-17T17:47:29.528758
2c1bb307-7fbe-4974-bccf-34833e61b4ab,2,Buyer,"(still skeptical) I'm not convinced. We've already made significant investments in our own data infrastructure, and I'm not sure I want to add another vendor to the mix. What kind of integration would be required to get DeepData AI up and running, and how would it impact our existing workflows?",50,295,2026-02-17T17:47:29.528758
2c1bb307-7fbe-4974-bccf-34833e61b4ab,3,Seller,"I completely understand your concerns about integration and workflow disruption. Our solution is designed to be highly adaptable and integrates seamlessly with existing data infrastructure, including Dynatrace. We've developed pre-built connectors and APIs to minimize the lift required for integration. In terms of workflow impact, our solution is designed to augment and enhance existing processes, not disrupt them. We've seen customers achieve significant benefits with minimal disruption to their existing workflows.",71,521,2026-02-17T17:47:29.528758
2c1bb307-7fbe-4974-bccf-34833e61b4ab,3,Buyer,"(somewhat intrigued) Okay, I'll give you a few more minutes. Can you walk me through a specific example of how DeepData AI has helped a similar company to ours? What kind of results did they see, and what were the key benefits of implementing your solution?",46,257,2026-02-17T17:47:29.528758
2c1bb307-7fbe-4974-bccf-34833e61b4ab,4,Seller,"Absolutely. One of our customers, a leading fintech company, was struggling with data latency and quality issues. By implementing DeepData AI, they were able to reduce their data latency by 50% and improve data quality by 30%. This resulted in significant improvements to their decision-making and business outcomes. I can share a case study with you if you're interested, and we can discuss how similar benefits might apply to your organization.",71,446,2026-02-17T17:47:29.528758
91a7ad37-51f5-4b16-a680-4867a009ca22,1,Seller,"Hi, my name is Alex and I'm reaching out from DeepData AI. We're a data processing solution that helps companies like yours optimize their data infrastructure and improve their overall business performance. I came across your company and noticed you're using New Relic for monitoring and observability. Can you tell me a bit about your current data processing workflow and how you're using New Relic?",65,400,2026-02-17T17:47:35.763387
91a7ad37-51f5-4b16-a680-4867a009ca22,1,Buyer,"(skeptical) Ah, another sales call. Look, we're happy with New Relic, it's doing its job. What makes you think we need something else? We've invested a lot in our current setup and I'm not sure I want to add another tool to the mix.",44,232,2026-02-17T17:47:35.763387
91a7ad37-51f5-4b16-a680-4867a009ca22,2,Seller,"I completely understand your concerns, and I'm not here to replace New Relic. However, our solution complements monitoring tools like New Relic by providing a deeper level of data processing and analysis. We've seen companies like yours use our solution to reduce data processing time by up to 70% and gain more actionable insights from their data. I'd love to explore if there are any specific pain points in your current workflow that we could help address.",77,459,2026-02-17T17:47:35.763387
91a7ad37-51f5-4b16-a680-4867a009ca22,2,Buyer,"(still skeptical) I'm not sure I buy into the whole ""complementary solution"" pitch. We've got a large engineering team and a complex infrastructure, I'm not sure adding another tool would simplify things. Plus, we're already paying a premium for New Relic, I'm not sure I want to add another expense to our budget.",53,314,2026-02-17T17:47:35.763387
91a7ad37-51f5-4b16-a680-4867a009ca22,3,Seller,"I understand your concerns about complexity and cost. However, our solution is designed to be highly scalable and integrates seamlessly with existing tools like New Relic. We've worked with similar companies to yours and have seen significant ROI from our solution. In fact, one of our customers was able to reduce their data processing costs by 40% after implementing our solution. I'd be happy to provide a custom quote and ROI analysis to see if our solution would be a good fit for your team.",85,496,2026-02-17T17:47:35.763387
91a7ad37-51f5-4b16-a680-4867a009ca22,3,Buyer,"(somewhat interested) Okay, I'll listen. But I need to see some concrete numbers and use cases before I'll even consider it. And I need to know how this will integrate with our existing New Relic setup. Can you send me some more information and maybe schedule a follow-up call to discuss further?",52,296,2026-02-17T17:47:35.763387
91a7ad37-51f5-4b16-a680-4867a009ca22,4,Seller,"Absolutely, I'd be happy to send over some case studies and a custom quote. And I'd love to schedule a follow-up call to discuss the integration with New Relic in more detail. Would next Wednesday or Thursday work for you? And in the meantime, I can also provide a trial or proof-of-concept to demonstrate the value of our solution in your specific environment.",63,361,2026-02-17T17:47:35.763387
b89023ae-9139-4e08-8f71-cc99edcce5e9,1,Seller,"Hi, my name is Alex and I'm reaching out from DeepData AI. I came across your company, Cloudflare, and was impressed by the work you're doing in the connectivity cloud space. I'd love to discuss how our data processing solution can help accelerate your AI adoption and enhance your security suite.",51,297,2026-02-17T17:47:42.053257
b89023ae-9139-4e08-8f71-cc99edcce5e9,1,Buyer,"(skeptical) Ah, another AI solution, huh? We're already doing some amazing things with AI at Cloudflare. What makes DeepData AI so special that I should care?",26,158,2026-02-17T17:47:42.053257
b89023ae-9139-4e08-8f71-cc99edcce5e9,2,Seller,"I completely understand your skepticism, but our solution is specifically designed to handle large volumes of data and provide real-time insights that can inform your AI decision-making. We've seen significant success with similar companies in the past, and I'd love to share some case studies with you. For example, we helped a major cybersecurity firm reduce their data processing time by 75% and improve their threat detection accuracy by 30%.",70,446,2026-02-17T17:47:42.053257
b89023ae-9139-4e08-8f71-cc99edcce5e9,2,Buyer,(still skeptical) That sounds like a sales pitch. How do I know it'll actually work for us? We've got a complex infrastructure and a lot of custom-built solutions. I'm not sure your product would even integrate with our systems.,39,228,2026-02-17T17:47:42.053257
b89023ae-9139-4e08-8f71-cc99edcce5e9,3,Seller,"I understand your concerns about integration. We've actually worked with several companies that have similar complex infrastructures, and our solution is designed to be highly adaptable. We offer a free trial and a proof-of-concept implementation to ensure that our solution meets your specific needs and integrates seamlessly with your existing systems. Would you be open to discussing this further and exploring how we can tailor our solution to your requirements?",70,466,2026-02-17T17:47:42.053257
b89023ae-9139-4e08-8f71-cc99edcce5e9,3,Buyer,"(somewhat intrigued) Okay, fine. I'll give you 10 minutes. But make it quick and make it worth my while. What's the one thing that you think would really resonate with me and make me want to move forward with DeepData AI?",41,221,2026-02-17T17:47:42.053257
b89023ae-9139-4e08-8f71-cc99edcce5e9,4,Seller,"(confidently) Based on my research, I think what would really resonate with you is our ability to provide real-time data processing and insights that can enhance your AI Security Suite. Our solution can help you detect and respond to threats more quickly and effectively, which aligns perfectly with Cloudflare's mission to make the internet a safer place. I'd love to set up a follow-up meeting to dive deeper into this and explore how we can work together to achieve this goal. Would that be something you'd be interested in?",89,527,2026-02-17T17:47:42.053257
121e8121-61ed-4eb2-af9b-80a0a5d436e3,1,Seller,"Hi, my name is Alex and I'm a Sales Development Representative at DeepData AI. I came across Fastly and was impressed with the work you're doing in edge cloud platforms. I'd love to introduce you to our data processing solution that can help optimize your operations and improve performance.",49,291,2026-02-17T17:47:48.169986
121e8121-61ed-4eb2-af9b-80a0a5d436e3,1,Buyer,"(sighs) Another sales call. What makes you think we need another data processing solution, Alex? We already have a robust system in place with our edge cloud platform.",28,167,2026-02-17T17:47:48.169986
121e8121-61ed-4eb2-af9b-80a0a5d436e3,2,Seller,"I understand your skepticism, but our solution is specifically designed to handle large amounts of data at scale, which is perfect for a company like Fastly that's handling over 1.8 trillion daily requests. Our AI-powered engine can help reduce latency, improve data accuracy, and provide valuable insights that can inform your business decisions.",53,347,2026-02-17T17:47:48.169986
121e8121-61ed-4eb2-af9b-80a0a5d436e3,2,Buyer,"(interrupting) Look, Alex, we've invested heavily in our current infrastructure, and I'm not convinced that your solution can integrate seamlessly with our existing systems. Plus, we've got a team of experienced engineers who can handle our data processing needs in-house.",40,272,2026-02-17T17:47:48.169986
121e8121-61ed-4eb2-af9b-80a0a5d436e3,3,Seller,"I completely understand your concerns about integration and internal capabilities. However, our solution is designed to be modular and can be easily integrated with existing systems, including edge cloud platforms like yours. Additionally, our AI-powered engine can actually augment your team's capabilities, freeing them up to focus on higher-level tasks and strategic initiatives. We've seen similar companies achieve significant ROI and performance improvements with our solution.",66,483,2026-02-17T17:47:48.169986
121e8121-61ed-4eb2-af9b-80a0a5d436e3,3,Buyer,"(still skeptical) Okay, Alex, I'll give you a few minutes more. But can you give me some specific examples of how DeepData AI has helped similar companies in the past? And what kind of ROI are we talking about?",39,210,2026-02-17T17:47:48.169986
121e8121-61ed-4eb2-af9b-80a0a5d436e3,4,Seller,"Absolutely. One of our customers, a leading e-commerce platform, saw a 30% reduction in latency and a 25% improvement in data accuracy after implementing our solution. Another customer, a streaming service, was able to increase their user engagement by 20% after gaining valuable insights from our AI-powered engine. In terms of ROI, our average customer sees a return of 3-5 times their investment within the first year. I'd be happy to set up a demo and provide more case studies to illustrate the value we can bring to Fastly.",89,529,2026-02-17T17:47:48.169986
215edbe7-5cd7-4a3d-9fc4-c34158ba8ac7,1,Seller,"Hi, my name is Alex and I'm reaching out from DeepData AI. I came across your company while researching innovative tech firms, and I noticed you're using Rubrik for data management. I'd love to introduce you to our solution, which can help optimize your data processing and reduce costs. Can you spare a few minutes to discuss?",57,327,2026-02-17T17:49:31.991124
215edbe7-5cd7-4a3d-9fc4-c34158ba8ac7,1,Buyer,"(sighs) Look, we're happy with our current setup. What makes you think we need something new? And how did you even get my number?",24,129,2026-02-17T17:49:31.991124
215edbe7-5cd7-4a3d-9fc4-c34158ba8ac7,2,Seller,"I apologize if this call is unexpected. I found your contact information through a industry directory. Regarding your current setup, I've worked with several companies who were satisfied with their existing solutions, but after implementing DeepData AI, they saw significant improvements in data processing efficiency and cost savings. Our AI-powered engine can help you uncover hidden insights and automate tasks, freeing up your team to focus on higher-value projects. Would you be open to exploring how our solution can complement your existing infrastructure?",83,563,2026-02-17T17:49:31.991124
215edbe7-5cd7-4a3d-9fc4-c34158ba8ac7,2,Buyer,"(skeptical) I'm not sure I buy into the whole ""AI-powered"" hype. We've tried similar solutions before, and they didn't deliver on their promises. What makes DeepData AI different, and how can you guarantee it will work for us?",38,226,2026-02-17T17:49:31.991124
215edbe7-5cd7-4a3d-9fc4-c34158ba8ac7,3,Seller,"I completely understand your skepticism, and I appreciate your willingness to consider alternative solutions. DeepData AI is different because it's specifically designed for enterprises like yours, with complex data environments. Our solution has been tested and proven in various industries, with an average ROI of 300% within the first year. I'd be happy to provide case studies and references from our existing clients. Additionally, we offer a pilot program that allows you to test our solution in a controlled environment, so you can see the value for yourself before making any commitments.",92,596,2026-02-17T17:49:31.991124
215edbe7-5cd7-4a3d-9fc4-c34158ba8ac7,3,Buyer,"(still hesitant) I suppose it couldn't hurt to take a look. But I need to warn you, our IT team is very protective of our current infrastructure, and it'll take a lot to convince them to adopt something new. What kind of support and resources do you offer to ensure a smooth implementation and integration with our existing systems?",59,332,2026-02-17T17:49:31.991124
215edbe7-5cd7-4a3d-9fc4-c34158ba8ac7,4,Seller,"I completely understand the concerns of your IT team, and I appreciate your transparency. We have a dedicated implementation team that works closely with our clients to ensure seamless integration with their existing infrastructure. We also provide comprehensive training and support to ensure your team is comfortable using our solution. I'd be happy to set up a call with our implementation team to discuss the details and answer any questions your IT team may have. Would that be something you'd be interested in exploring further?",85,534,2026-02-17T17:49:31.991124
539de755-236e-4d8d-8838-b072c9253a2f,1,Seller,"Hi, my name is Alex and I'm a Sales Development Representative at DeepData AI. I came across your company and was impressed with the work you're doing in data streaming. I'd love to explore how our data processing solution can help you streamline your operations and improve real-time decision-making.",49,301,2026-02-17T17:49:38.157289
539de755-236e-4d8d-8838-b072c9253a2f,1,Buyer,"(skeptical) Ah, another data processing solution. What makes yours different from Confluent or Apache Kafka, which we're already using? We've invested a lot in our current infrastructure, and I'm not sure we're looking to switch anytime soon.",37,242,2026-02-17T17:49:38.157289
539de755-236e-4d8d-8838-b072c9253a2f,2,Seller,"I completely understand your concerns, and I'm not here to convince you to rip and replace your existing infrastructure. Our solution, DeepData AI, is actually designed to complement and enhance your current data streaming capabilities. We provide advanced data processing and machine learning capabilities that can help you extract more insights from your data, and our integration with Confluent and Kafka is seamless. We've had success with other companies who were using similar technologies, and I'd love to share some case studies with you.",84,546,2026-02-17T17:49:38.157289
539de755-236e-4d8d-8838-b072c9253a2f,2,Buyer,"(still skeptical) Okay, I'll listen. But I have to say, we've been pretty happy with Confluent's capabilities so far. What specific pain points do you think your solution can address that Confluent can't? And what kind of ROI can we expect from implementing your solution?",45,272,2026-02-17T17:49:38.157289
539de755-236e-4d8d-8838-b072c9253a2f,3,Seller,"That's a great question. From what I've seen, companies like yours often struggle with data quality and latency issues, which can lead to downstream problems and delayed decision-making. Our solution provides real-time data validation and cleansing capabilities, which can help prevent those issues. Additionally, our machine learning algorithms can help you identify patterns and anomalies in your data that might be missed by traditional analytics tools. As for ROI, our customers have seen significant reductions in data processing costs and improvements in data-driven decision-making. I can share some specific numbers and examples with you if you're interested.",97,667,2026-02-17T17:49:38.157289
539de755-236e-4d8d-8838-b072c9253a2f,3,Buyer,"(somewhat interested) Okay, I'm listening. But I have to say, we're in the middle of a major project right now, and I'm not sure we have the bandwidth to take on another implementation. What kind of resources would we need to dedicate to get your solution up and running, and what kind of support do you offer to ensure a smooth onboarding process?",63,348,2026-02-17T17:49:38.157289
539de755-236e-4d8d-8838-b072c9253a2f,4,Seller,"I completely understand your concerns about resources and timing. Our implementation process is designed to be as lightweight and flexible as possible, and we provide dedicated support and training to ensure a smooth onboarding process. We've also developed a phased implementation approach that can be tailored to your specific needs and timeline. I'd be happy to walk you through the details and answer any questions you may have. Would you be open to a follow-up conversation next week to discuss further?",81,508,2026-02-17T17:49:38.157289
