simulation_id,turn_number,speaker,message,word_count,char_count,timestamp
fcfca8ac-5b29-45a3-83bf-ddb48935399c,1,Seller,"Hi [CTO Name], this is Alex from DeepData AI. I know you're likely busy, but I'm reaching out because we help organizations like the Apache Software Foundation streamline their complex data processing pipelines and unlock deeper insights. Are you the right person to speak with about how you manage your project data and contributions?",54,335,2026-02-19T16:09:18.686630
fcfca8ac-5b29-45a3-83bf-ddb48935399c,1,Buyer,"Apache Software Foundation. Yes, I'm the CTO here. DeepData AI, you say? We're a non-profit organization driven by community contributions. Our primary focus is providing software for the public good. We're not really in the market for commercial data processing solutions.",41,273,2026-02-19T16:09:18.686630
fcfca8ac-5b29-45a3-83bf-ddb48935399c,2,Seller,"I understand completely, and your mission is incredibly impressive. That's exactly why I thought of you. We work with organizations that manage vast amounts of data from diverse sources, and many of our clients are also mission-driven. DeepData AI can help automate the aggregation and analysis of your project data, release statistics, committer activity, and even identify trends in community engagement. This could free up valuable developer time to focus on core project development rather than data wrangling.",78,514,2026-02-19T16:09:18.686630
fcfca8ac-5b29-45a3-83bf-ddb48935399c,2,Buyer,"""Free up developer time"" is a nice thought, but our community contributors are passionate about their work. We have existing internal tools and processes for managing our data. Frankly, I'm not sure a commercial solution like yours would even integrate well with our open-source ecosystem. And what kind of pricing are we talking about for a non-profit?",57,353,2026-02-19T16:09:18.686630
fcfca8ac-5b29-45a3-83bf-ddb48935399c,3,Seller,"That's a fair question, and integration is something we've designed DeepData AI to handle robustly. We have connectors for many common data sources and can often build custom ones. Regarding pricing, we have specific non-profit and academic tiers designed to be accessible. Many organizations find that the efficiency gains and enhanced insights quickly offset the investment, allowing them to achieve their mission more effectively. We could even look at a pilot program to demonstrate value before any significant commitment.",79,527,2026-02-19T16:09:18.686630
fcfca8ac-5b29-45a3-83bf-ddb48935399c,3,Buyer,"A pilot program sounds like more work for my team to set up and evaluate. We're currently in the midst of a major infrastructure upgrade and our bandwidth is completely consumed by that for the next 18 months. I appreciate the offer, Alex, but this is not a priority for us right now, and the timing is simply impossible. Please send me an email with some general information, and I'll… well, I'll file it.",74,406,2026-02-19T16:09:18.686630
fcfca8ac-5b29-45a3-83bf-ddb48935399c,4,Seller,"I understand completely about infrastructure priorities, [CTO Name]. It sounds like you have a lot on your plate. While I respect your current focus, I'd still like to offer a brief, 15-minute overview of how DeepData AI has helped other large open-source foundations manage their data more efficiently, even alongside existing systems. It might spark an idea for future consideration. Would you be open to a quick call next Tuesday at 10 AM EST?",74,446,2026-02-19T16:09:18.686630
fcfca8ac-5b29-45a3-83bf-ddb48935399c,4,Buyer,"No, thank you, Alex. As I said, the timing is not right, and we're not actively looking for solutions in this space. I truly don't have the capacity to evaluate new technologies. I've already told you we're not interested. Goodbye.",40,231,2026-02-19T16:09:18.686630
f9c56612-ab1c-4dd8-b5c4-be3c94c64708,1,Seller,"Hi Alex, this is Sarah from DeepData AI. I know you're incredibly busy, especially with the current technical difficulties Oracle seems to be having. We help companies like yours, who are grappling with complex data processing, to significantly improve efficiency and reduce downtime. I saw a recent report about your team's focus on optimizing backend infrastructure, and I was wondering if you'd be open to a quick 15-minute chat about how we're seeing similar challenges addressed?",76,484,2026-02-19T16:09:34.533107
f9c56612-ab1c-4dd8-b5c4-be3c94c64708,1,Buyer,"(Sighs) Sarah, honestly, my inbox is flooded with similar pitches, and frankly, my team is drowning trying to keep our own systems operational, let alone explore new solutions. The Oracle site issues are a major headache. Right now, anything that isn't an immediate fire fix is a low priority.",49,293,2026-02-19T16:09:34.533107
f9c56612-ab1c-4dd8-b5c4-be3c94c64708,2,Seller,"I completely understand, Alex. The Oracle situation sounds incredibly frustrating, and I definitely don't want to add to your burden. We've actually worked with several large enterprises that faced similar, widespread system outages, and our solution helped them not only stabilize their data processing during such crises but also identify the root causes of those issues faster, preventing future recurrences. Is there a specific aspect of the current disruption that's proving most challenging for your team?",76,511,2026-02-19T16:09:34.533107
f9c56612-ab1c-4dd8-b5c4-be3c94c64708,2,Buyer,"It's not just one aspect; it's the entire process. We've got multiple vendor relationships to manage, and everyone's pointing fingers. Frankly, we're already invested in a suite of data management tools, and the integration overhead for anything new is a huge deterrent. We can't afford another complex implementation right now.",50,328,2026-02-19T16:09:34.533107
f9c56612-ab1c-4dd8-b5c4-be3c94c64708,3,Seller,"That's a very valid concern, Alex. Integration complexity is a major reason why many of our clients turn to DeepData AI. We've specifically engineered our platform for seamless integration with existing data stacks, often requiring minimal code changes and significantly reducing the typical implementation timeline. We can usually have a basic integration up and running within days, not months. Would you be at all curious to see a brief, high-level overview of how our integration process typically looks, even if it's just for future reference?",85,548,2026-02-19T16:09:34.533107
f9c56612-ab1c-4dd8-b5c4-be3c94c64708,3,Buyer,"Look, Sarah, I appreciate you trying to tailor the pitch, but we're not in a position to evaluate new solutions. Our immediate focus is resolving the current situation and then reassessing our existing vendor contracts. I'll have our head of data engineering review our current data processing tools and identify any gaps, but we're not actively looking to bring in new vendors at this time. Please send me an email with your company's capabilities, and if a need arises down the line, we'll reach out.",85,502,2026-02-19T16:09:34.533107
f9c56612-ab1c-4dd8-b5c4-be3c94c64708,4,Seller,"Understood, Alex. I'll be sure to send that over. Thank you for your time.",14,74,2026-02-19T16:09:34.533107
e594dae4-22d3-46d1-87b1-ca12abf2604d,1,Seller,"Hi [Buyer Name], this is [Seller Name] calling from DeepData AI. I hope I'm not catching you at a bad time.",21,107,2026-02-19T16:09:51.486042
e594dae4-22d3-46d1-87b1-ca12abf2604d,1,Buyer,"It's actually not a great time, I've got a release coming up. Who is this and what is this about?",20,97,2026-02-19T16:09:51.486042
e594dae4-22d3-46d1-87b1-ca12abf2604d,2,Seller,"I understand completely, [Buyer Name]. I'll be brief. We help companies like yours leverage their PostgreSQL data more effectively for AI and machine learning initiatives. I saw your recent release notes for PostgreSQL 18.2 and was impressed with the continued development.",41,273,2026-02-19T16:09:51.486042
e594dae4-22d3-46d1-87b1-ca12abf2604d,2,Buyer,"Look, we're happy with PostgreSQL. It's been our foundation for years, and we have internal teams managing it. What makes you think we need an external ""solution""?",27,163,2026-02-19T16:09:51.486042
e594dae4-22d3-46d1-87b1-ca12abf2604d,3,Seller,"That's a fair question, [Buyer Name]. Our clients typically come to us when they realize the complexity and resource drain involved in preparing vast amounts of PostgreSQL data for advanced analytics, especially with the rapid growth of AI. We're not trying to replace PostgreSQL; rather, we augment its capabilities by streamlining the ETL process for ML models, reducing time-to-insight significantly. For instance, one of our clients in the fintech space cut their data preparation time by 70%.",77,497,2026-02-19T16:09:51.486042
e594dae4-22d3-46d1-87b1-ca12abf2604d,3,Buyer,"70%? That sounds like marketing fluff. We have robust ETL tools already, and our data engineers are perfectly capable of handling our needs. frankly, the idea of integrating another layer into our already complex stack is not appealing right now, especially with this release on our plates.",47,290,2026-02-19T16:09:51.486042
e594dae4-22d3-46d1-87b1-ca12abf2604d,4,Seller,"I appreciate you sharing that, [Buyer Name]. We often hear that from teams who have existing tools, and that's why we focus on seamless integration. DeepData AI is designed to plug into your existing PostgreSQL environment without requiring a full overhaul, minimizing disruption. We understand the importance of your upcoming release and can schedule a brief, focused discussion on how we can specifically address potential data bottlenecks for your AI projects, perhaps after things settle down.",76,497,2026-02-19T16:09:51.486042
e594dae4-22d3-46d1-87b1-ca12abf2604d,4,Buyer,"""After things settle down"" is a long time away. We're not actively looking for new solutions, and frankly, the cost of another tool is a major concern we haven't budgeted for. Send me an email with some more information, and if anything changes, I'll reach out.",46,261,2026-02-19T16:09:51.486042
794cde55-b601-4098-a9ed-bec99ad821bf,1,Seller,"Hi [CTO's Name], this is [SDR's Name] from DeepData AI. I know you're likely busy, but I'm reaching out because we work with a lot of companies that leverage Jenkins for their CI/CD pipelines, and we've found a significant opportunity to improve their data processing efficiency. Is now a bad time?",51,298,2026-02-19T16:10:07.241047
794cde55-b601-4098-a9ed-bec99ad821bf,1,Buyer,"[CTO's Name]: DeepData AI? Never heard of you. And no, now isn't a great time. We're heads-down on a major release. What is it you do?",26,134,2026-02-19T16:10:07.241047
794cde55-b601-4098-a9ed-bec99ad821bf,2,Seller,"I understand. We help organizations like yours streamline and accelerate their data processing, particularly the kind of data generated by complex build and deployment processes. Given Jenkins' ubiquity, we often see bottlenecks in how that data is analyzed for insights into development velocity and potential issues. Our platform uses AI to process this data significantly faster and uncover patterns traditional methods miss.",62,428,2026-02-19T16:10:07.241047
794cde55-b601-4098-a9ed-bec99ad821bf,2,Buyer,"[CTO's Name]: ""AI for data processing."" That's a pretty broad claim. We're using Jenkins extensively, yes, but we already have our own internal analytics tools and a team dedicated to interpreting that data. Frankly, I don't see what a third-party solution could offer that we can't already handle.",48,298,2026-02-19T16:10:07.241047
794cde55-b601-4098-a9ed-bec99ad821bf,3,Seller,"I appreciate that. Many of our clients felt the same initially. The key difference with DeepData AI is the *depth* and *speed* of analysis. For instance, are you currently able to automatically identify the root cause of flaky tests across your entire Jenkins history, or predict potential deployment failures before they happen based on historical build metrics? We've seen companies reduce their data processing time by up to 70% and uncover critical issues that were previously invisible.",77,491,2026-02-19T16:10:07.241047
794cde55-b601-4098-a9ed-bec99ad821bf,3,Buyer,"[CTO's Name]: Look, I appreciate the enthusiasm, but that sounds like a significant integration effort and a substantial cost. We're not actively looking for new tools right now, and honestly, I'm skeptical about the ROI on something like this without seeing concrete proof. We have a solid system in place and our priorities are elsewhere.",55,340,2026-02-19T16:10:07.241047
794cde55-b601-4098-a9ed-bec99ad821bf,4,Seller,"I understand your hesitation regarding integration and cost. We've designed DeepData AI to integrate seamlessly with Jenkins via existing plugins, minimizing disruption and usually taking less than a day to get up and running. We also offer flexible pricing models tailored to your data volume. To address your skepticism, I'd love to show you a brief, 15-minute demo specifically focused on how we could analyze your Jenkins data. We could even run a sample analysis on a subset of your anonymized build logs to demonstrate the insights we can uncover. How about we schedule that for Tuesday morning?",98,601,2026-02-19T16:10:07.241047
794cde55-b601-4098-a9ed-bec99ad821bf,4,Buyer,"[CTO's Name]: No, thank you. We're happy with our current setup and have no budget allocated for this type of solution. Please don't call again.",25,144,2026-02-19T16:10:07.241047
26a30448-04ce-40ce-ba83-113d7c91ac86,1,Seller,"Hi Alex, this is Sarah from DeepData AI. I'm reaching out because I noticed Docker is heavily invested in accelerating container application development, and we've been seeing a lot of companies in that space grappling with the complexity and cost of processing large volumes of development and operational data. Is this something that resonates with you at all?",58,362,2026-02-19T16:10:23.555564
26a30448-04ce-40ce-ba83-113d7c91ac86,1,Buyer,"Sarah, thanks for the call, but I'm going to be blunt. We get a lot of these pitches, and honestly, we're pretty dialed in on our infrastructure. What exactly is this ""DeepData AI"" you're selling?",35,196,2026-02-19T16:10:23.555564
26a30448-04ce-40ce-ba83-113d7c91ac86,2,Seller,"I understand. We're not trying to replace anything you're doing. DeepData AI specializes in intelligent data processing, specifically for DevSecOps environments like yours. We help teams extract actionable insights from logs, traces, and metrics at scale, which can dramatically reduce troubleshooting time and improve application performance. Given Docker's focus on a safer, more efficient container ecosystem, we believe our solution could complement that by providing deeper visibility into the performance and security of those deployed applications.",76,555,2026-02-19T16:10:23.555564
26a30448-04ce-40ce-ba83-113d7c91ac86,2,Buyer,"""Deeper visibility."" That's a broad claim. We're already using a combination of tools for our observability. We have our own logging infrastructure, and we're pretty happy with our current solutions. What makes DeepData AI so different, and frankly, worth the time to even look at?",45,281,2026-02-19T16:10:23.555564
26a30448-04ce-40ce-ba83-113d7c91ac86,3,Seller,"That's a fair question, Alex. Many companies use point solutions, which is understandable. What sets DeepData AI apart is its AI-driven approach to anomaly detection and root cause analysis across disparate data sources. Instead of just aggregating data, we proactively identify issues, predict potential problems before they impact users, and can even suggest remediation steps. For example, we've helped organizations like yours cut down on incident response time by up to 40%.",72,479,2026-02-19T16:10:23.555564
26a30448-04ce-40ce-ba83-113d7c91ac86,3,Buyer,"40%? That sounds like a sales statistic. Look, we're currently in the middle of a major security initiative, and frankly, data processing is not high on my priority list right now. We're focused on hardening our images and ensuring compliance, as your own marketing materials suggest you do. My budget is locked down for the next fiscal year.",58,342,2026-02-19T16:10:23.555564
26a30448-04ce-40ce-ba83-113d7c91ac86,4,Seller,"I appreciate you being upfront about your priorities and budget cycle, Alex. We often find that teams focused on security and compliance are also the ones most impacted by the challenges of understanding and managing the vast amounts of data generated by their containerized applications. Our solution can actually *support* your security initiatives by identifying unusual patterns that might indicate a breach or misconfiguration. However, I completely respect that now isn't the right time. I'll leave it at that and won't take up any more of your time.",88,556,2026-02-19T16:10:23.555564
26a30448-04ce-40ce-ba83-113d7c91ac86,4,Buyer,"Right. Well, Sarah, I appreciate you understanding. If something changes down the line, or if this becomes a more pressing concern, I'll keep DeepData AI in mind. But for now, we're good.",32,187,2026-02-19T16:10:23.555564
76d7b1a8-47e8-4105-a7ca-54dae2228a34,1,Seller,"Hi Alex, this is Sarah calling from DeepData AI. I know you're likely busy, especially with KubeCon Europe just around the corner, but I wanted to reach out briefly. Our team focuses on helping companies like yours, who are heavily invested in containerized environments like Kubernetes, optimize their data processing and analytics.",52,333,2026-02-19T16:12:36.912010
76d7b1a8-47e8-4105-a7ca-54dae2228a34,1,Buyer,"Sarah, thanks for the call, but honestly, KubeCon is our absolute focus right now. We've got teams preparing presentations, and the last thing I need is another vendor pitch. We're not actively looking for new data solutions.",37,225,2026-02-19T16:12:36.912010
76d7b1a8-47e8-4105-a7ca-54dae2228a34,2,Seller,"I completely understand the KubeCon focus, Alex. It's a fantastic event. My hope was to connect before things get too hectic, or perhaps after you've had a chance to decompress. The reason I reached out specifically to you, given your role at [Company Name], is that we've seen many companies using Kubernetes at scale, like yourselves, struggle with the sheer volume and complexity of their data pipelines, especially when it comes to extracting actionable insights without significant engineering overhead.",79,508,2026-02-19T16:12:36.912010
76d7b1a8-47e8-4105-a7ca-54dae2228a34,2,Buyer,We have our internal solutions for that. Our DevOps team has built a robust data ingestion and processing layer that integrates well with our Kubernetes infrastructure. It's cost-effective and we have full control.,33,214,2026-02-19T16:12:36.912010
76d7b1a8-47e8-4105-a7ca-54dae2228a34,3,Seller,"That's great you have that in-house capability, Alex. Many companies do. Where DeepData AI often finds its niche is in accelerating those complex data processing tasks, especially for AI/ML workloads, and providing advanced anomaly detection and predictive analytics on that data, often saving considerable compute costs and engineering time. For example, we've helped companies reduce their data processing cycles by up to 40%. Is that something that resonates at all with your current data strategy, even if it's not an immediate priority?",82,541,2026-02-19T16:12:36.912010
76d7b1a8-47e8-4105-a7ca-54dae2228a34,3,Buyer,"Look, Sarah, I appreciate the follow-up and the general overview. But ""accelerating"" and ""saving costs"" are pretty standard claims. We've looked at various solutions in the past, and frankly, the integration challenges with Kubernetes and the licensing costs have always been prohibitive. We're not looking to rip and replace what's working, and we're certainly not in a budget cycle for a new, significant data platform investment.",66,432,2026-02-19T16:12:36.912010
76d7b1a8-47e8-4105-a7ca-54dae2228a34,4,Seller,"I hear you, Alex. Integration complexity and cost are definitely top concerns for CTOs, especially within a Kubernetes ecosystem. That's precisely why DeepData AI is designed with native Kubernetes integrations and a consumption-based pricing model that scales with your usage, not just upfront licenses. We can usually demonstrate significant ROI within the first quarter of implementation.",56,391,2026-02-19T16:12:36.912010
76d7b1a8-47e8-4105-a7ca-54dae2228a34,4,Buyer,"That's all well and good in theory, but I don't have the bandwidth to evaluate another vendor right now. We're deep in KubeCon preparations, and frankly, this isn't on my radar. My priority is ensuring our team has a smooth experience at the conference and that our current infrastructure remains stable. I'm going to have to politely decline any further discussion on this for the foreseeable future.",67,401,2026-02-19T16:12:36.912010
7b739565-ec2f-43d4-8714-b3213e2d981f,1,Seller,"Hi, my name is Alex and I'm reaching out from DeepData AI. We're a data processing solution that helps companies like yours optimize their infrastructure and improve efficiency. I saw that you're using Terraform and I thought our solution could be a great fit. Can I take a minute to explain how it works?",54,305,2026-02-19T16:18:49.479984
7b739565-ec2f-43d4-8714-b3213e2d981f,1,Buyer,"(sighs) Okay, fine. But make it quick. We're in the middle of a big project and I don't have a lot of time to spare. What makes you think your solution is relevant to us?",35,170,2026-02-19T16:18:49.479984
7b739565-ec2f-43d4-8714-b3213e2d981f,2,Seller,"Absolutely, I understand your time is valuable. Our solution integrates seamlessly with Terraform, allowing you to automate data processing and reduce manual errors. We've seen companies like yours achieve significant cost savings and improved productivity. Would you like to hear some specific examples?",43,304,2026-02-19T16:18:49.479984
7b739565-ec2f-43d4-8714-b3213e2d981f,2,Buyer,(skeptical) I'm not sure I'm interested in hearing examples. We already have a data processing solution in place and it's working fine for us. What makes yours better?,28,167,2026-02-19T16:18:49.479984
7b739565-ec2f-43d4-8714-b3213e2d981f,3,Seller,"I understand you have an existing solution, but our AI-powered engine can handle complex data sets and provide real-time insights that might not be possible with your current setup. We've also seen our solution reduce data processing time by up to 50%. I'd love to show you a demo and see if it can address any specific pain points you're experiencing.",61,352,2026-02-19T16:18:49.479984
7b739565-ec2f-43d4-8714-b3213e2d981f,3,Buyer,"(firmly) Look, I appreciate the offer, but we're not looking to switch solutions right now. We're locked into a contract with our current provider and it's not a priority for us to explore other options. Maybe send me an email with some more information and I'll review it when I have time.",52,290,2026-02-19T16:18:49.479984
7b739565-ec2f-43d4-8714-b3213e2d981f,4,Seller,"I completely understand. I'll send you an email with some more information, but I want to make sure you're aware that we're offering a free trial period that can help you test our solution without any commitment. Would you be open to discussing this further with our technical team to see if it's something that could work for you in the future?",62,345,2026-02-19T16:18:49.479984
7b739565-ec2f-43d4-8714-b3213e2d981f,4,Buyer,"(definitively) No, thank you. Like I said, we're not interested in exploring other options right now. We've got our hands full with our current project and I don't see us changing our data processing solution anytime soon. Please just send me the email and I'll review it when I have time. But I think it's unlikely we'll be moving forward with DeepData AI.",63,357,2026-02-19T16:18:49.479984
91a4d9ad-29cc-46b9-b396-6a8e149a14c4,1,Seller,"Hi, my name is Alex and I'm reaching out from DeepData AI. We're a data processing solution that helps investment management companies like Confluence Technologies optimize their data efficiency and control. I came across your company and was impressed with the work you're doing in regulatory compliance and analytics. Can I ask, what are some of the biggest data challenges you're facing right now?",64,400,2026-02-19T16:29:29.007087
91a4d9ad-29cc-46b9-b396-6a8e149a14c4,1,Buyer,"Honestly, we're doing okay with our current systems, but I suppose we're always looking for ways to improve. What makes DeepData AI so special that it would be worth considering a change?",32,187,2026-02-19T16:29:29.007087
91a4d9ad-29cc-46b9-b396-6a8e149a14c4,2,Seller,"Well, our AI-powered engine allows for faster and more accurate data processing, which can significantly reduce the risk of regulatory fines and improve your overall compliance posture. For instance, our solution can help automate reporting and reduce manual errors. We've seen our clients achieve up to 30% reduction in compliance costs. Would you like to hear more about how our solution can address specific pain points you might be experiencing?",70,449,2026-02-19T16:29:29.007087
91a4d9ad-29cc-46b9-b396-6a8e149a14c4,2,Buyer,"I'm not sure that's something we're looking to invest in right now. We've got a pretty tight budget, and I'm not convinced that the ROI would be there for us. Plus, we're already working with a few different vendors for our data needs, so I'm not sure we'd be looking to add another solution to the mix.",57,303,2026-02-19T16:29:29.007087
91a4d9ad-29cc-46b9-b396-6a8e149a14c4,3,Seller,"I completely understand budget concerns, and I appreciate your transparency. However, I'd like to address the ROI concern. Our solution has been shown to pay for itself within the first year of implementation through reduced compliance costs and improved operational efficiency. As for working with multiple vendors, our solution is designed to integrate seamlessly with existing systems, so it wouldn't add complexity but rather streamline your data processing. Would a demo or meeting to discuss further and see if there's a potential fit make sense?",85,552,2026-02-19T16:29:29.007087
